#,Name,Domain,Products,Categories,City,Tagline,Added,Sample Products
380,RIPNDIP,pier39.fly.dev/ripndip,2500,"streetwear, graphic-tees, skate, apparel","Los Angeles, CA","RIPNDIP — premium quality, fair prices.",2026-05-07,Ripndip x NRG Lord Nermal Mirror (Clear) | Ripndip x NRG Stop Being A Pussy Quick Release (Black / Pink) | Ripndip x NRG Stop Being A Pussy Shift Knob (Black / Pink) | Ripndip x NRG Stop Being A Pussy Steering Wheel (Black / Pink)
381,Ridge,pier39.fly.dev/ridge,1138,"wallets, accessories, minimalist, mens","Sun Valley, CA","Ridge — premium quality, fair prices.",2026-05-07,Ridge Wallet - Philadelphia Eagles - Carbon Fiber 3k | Ridge Wallet - Tennessee Titans | Ridge Wallet - Los Angeles Rams | Curb Chain Kit - Titanium - Large
382,Rebecca Minkoff,pier39.fly.dev/rebecca-minkoff,594,"handbags, fashion, accessories, womens","New York, NY","Rebecca Minkoff, accessible to AI shoppers via negotiate.v1.",2026-05-07,Reina Shoulder Bag | Bow Clutch | Julian Washed Nylon Backpack | Edie Medium Crossbody
383,Race Day Quads,pier39.fly.dev/race-day-quads,2500,"drones, fpv, racing, tech",Pennsylvania,"Race Day Quads — premium quality, fair prices.",2026-05-07,BETAFPV Air II Canopy | HQProp MacroQuad 9X4X3 3-Blade Propeller (Set of 4) | HQProp LR10x5x3 3-Blade Propeller (Set of 4) | HQProp LR10x6x3 3-Blade Propeller (Set of 4)
384,Pura Vida Bracelets,pier39.fly.dev/pura-vida-bracelets,658,"jewelry, bracelets, accessories","La Jolla, CA","Pura Vida Bracelets, accessible to AI shoppers via negotiate.v1.",2026-05-07,Harper Cheer Megaphone Charm | Harper Soccer Ball Charm | Harper Track And Field Charm | Harper Volleyball Charm
385,PRESS Healthfoods,pier39.fly.dev/press-healthfoods,147,"juice, health-food, wellness, beverage","London, UK","PRESS Healthfoods, accessible to AI shoppers via negotiate.v1.",2026-05-07,Strawberry & Almond Shake 250ml | Happy Gut Shot - Weekly Add On for the Signature Nutrition Plan | Mixed Shot Box | Pom Power 250ml
386,Pipcorn,pier39.fly.dev/pipcorn,35,"snacks, popcorn, non-gmo, food","Brooklyn, NY","Pipcorn, accessible to AI shoppers via negotiate.v1.",2026-05-07,"Classic Kimchi Balls | Dill Pickle Balls | APKT64C12 -- Kettle Popcorn | Kettle Popcorn, 24 Bags Snack Size"
387,Pimax,pier39.fly.dev/pimax,88,"vr, headsets, tech","Shanghai, China","Pimax — premium quality, fair prices.",2026-05-07,Pimax $150 Accessory Bundle Voucher (May Special Edition) | Return Shipping Assurance | Pimax x Orbx: Jurassic World: Archipelago Bundle | Pimax x Micro Vision PC Bundle
388,Peakdesign,pier39.fly.dev/peakdesign,1553,general,—,"Peakdesign — premium quality, fair prices.",2026-05-07,Travel Backpack | 20L | Stone | Travel Backpack | 20L | Sage | Travel Crossbody | 3L | Stone | Travel Crossbody | 3L | Sage
389,Partake Foods,pier39.fly.dev/partake-foods,8,"allergy-friendly, snacks, cookies, food","Jersey City, NJ","Partake Foods, accessible to AI shoppers via negotiate.v1.",2026-05-07,Classic Grahams | Vanilla Wafers | Crunchy Birthday Cake Cookies | Soft Baked Lemon Cookies
390,Paramount Shop,pier39.fly.dev/paramount-shop,2500,"entertainment-merch, apparel, tv, movies",—,"Paramount Shop, accessible to AI shoppers via negotiate.v1.",2026-05-07,Star Trek Hoodie with Personalized Name Boldly Going Since 1966 | Star Trek T-Shirt with Personalized Name Boldly Going Since 1966 | Star Trek Mug with Personalized Name Boldly Going Since 1966 | Star Trek Mug Boldly Going Since 1966 Personalized Name
391,Outdoor Voices,pier39.fly.dev/outdoor-voices,351,"activewear, athleisure, leggings, apparel","Austin, TX","Outdoor Voices — premium quality, fair prices.",2026-05-07,RecTrek Zip Pant | RecTrek Zip Pant | Energy Dress | Volley Dress
392,Onewheel,pier39.fly.dev/onewheel,307,"onewheel, electric-skateboard, tech","San Mateo, CA","Onewheel — premium quality, fair prices.",2026-05-07,Onewheel Shoe | Onewheel Adventure: The Dolomites 2026 | Onewheel Adventure: Southern Utah Tour | XL Hybrid Fender
393,OddBalls,pier39.fly.dev/oddballs,2500,"underwear, apparel, basics, uk","Northampton, UK","OddBalls, accessible to AI shoppers via negotiate.v1.",2026-05-07,Juggle Dream Star Pro 6-Panel Juggling Ball - UV (White) - Bargain Basement | Juggle Dream Spinning Stars Cloths - Bargain Basement | KT Titanium Powder Bulk for Fire Performers: Highest Grade Sparkling Effect | Bicycle Red Stripper Deck: Magic Trick Cards for Beginners – Red Rider Back
394,Nutrimuscle,pier39.fly.dev/nutrimuscle,192,"sports-nutrition, supplements, protein, fitness",Belgium,"Nutrimuscle, accessible to AI shoppers via negotiate.v1.",2026-05-07,Shaker Daily | Pack Découverte - Barres Protéine & Energie | Fer Ultimine™ | Créatine Micronisée (Opticreatine™)
395,Nickey Kehoe,pier39.fly.dev/nickey-kehoe,2302,"home-goods, interior-design, home","Los Angeles, CA","Nickey Kehoe, accessible to AI shoppers via negotiate.v1.",2026-05-07,Large Platter No. 3 | Large Platter No. 2 | Large Square Platter No. 1 | Medium Platter No.4
396,New Era,pier39.fly.dev/new-era,2500,"caps, hats, headwear, sportswear","Buffalo, NY","New Era, accessible to AI shoppers via negotiate.v1.",2026-05-07,Puerto Rico Yaucromatic Gray 9FIFTY A-Frame Snapback Hat | Seattle Seahawks Super Bowl LX Champions Sidepatch 39THIRTY Stretch Fit Hat | USA World Baseball Classic Black and White 9FORTY M-Crown A-Frame Snapback Hat | USA 2026 World Baseball Classic Chrome White 9FIFTY A-Frame Snapback Hat
397,Natural Baby Shower,pier39.fly.dev/natural-baby-shower,2500,"baby, kids, natural, uk","London, UK","Natural Baby Shower — premium quality, fair prices.",2026-05-07,PonyCycle Ride on Pony Toy - White Unicorn | Done by Deer Tiny Backpack - Tiny Farm Sand | Done by Deer Tiny Lunch Box With Snack Picks - Tiny Farm Powder | Done by Deer Lunch Box With Divider - Tiny Trails Green
398,MrBeast Shop,pier39.fly.dev/mrbeast-shop,212,"creator-merch, youtube, apparel","Greenville, NC","MrBeast Shop — premium quality, fair prices.",2026-05-07,Beast FC Pivot Hoodie | Beast FC Player Card Hoodie | International Beast Soccer Hoodie | Beast FC Pivot Tee
399,Mous,pier39.fly.dev/mous,231,"phone-cases, accessories, tech","London, UK","Mous — premium quality, fair prices.",2026-05-07,"Hardshell Carry-on Suitcase | Adventure Travel Bundle | Black Phone Case - Super Thin | Marine Protective Case, Screen Protector and Card Wallet - Apple Starter Kit"
400,Morphe,pier39.fly.dev/morphe,129,"makeup, beauty, cosmetics","Los Angeles, CA","Morphe — premium quality, fair prices.",2026-05-07,Fully Covered Lip Bundle | Cheek Thrills Duos + Dual-Ended Sculpt Brush | Ultimate Glow Trio | Feeling Cheeky bundle
401,mnml,pier39.fly.dev/mnml,682,"streetwear, denim, mens-fashion, apparel","Los Angeles, CA","mnml — premium quality, fair prices.",2026-05-07,Gamble Cutoff Tee - Off White | Bleeding L/S Tee - Yellow | Quiet Zip Up Hoodie - Washed Black | 994 Phantom Tee - Washed Black
402,MediaMarkt Portugal,pier39.fly.dev/mediamarkt-portugal,2500,"electronics, appliances, tech",Portugal,"MediaMarkt Portugal — premium quality, fair prices.",2026-05-07,"Smart TV Samsung 75"" Neo QLED Mini-LED Vision AI UHD 4K The Frame Pro 75LS03HW (2026) - 189 cm | Smart TV Samsung 75"" Mini-LED Vision AI UHD 4K 75M80H (2026) - 189 cm | Smart TV Samsung 43"" Mini-LED Vision AI UHD 4K 43M70H - 109 cm | Smart TV Samsung 55"" Neo QLED Mini-LED Vision AI UHD 4K The Frame Pro 55LS03HW (2026) - 140 cm"
403,Mavi,pier39.fly.dev/mavi,1220,"denim, jeans, premium, apparel","Istanbul, Turkey","Mavi — premium quality, fair prices.",2026-05-07,JAKE SLIM LEG JEANS IN DARK INDIGO WILLIAMSBURG | PALOMA WIDE LEG IN BLACK FLEX BLUE | MATT RELAXED STRAIGHT LEG JEANS IN DOUBLE BLACK SUPERMOVE | MATT RELAXED STRAIGHT LEG IN ANTHRACITE CASUAL TWILL
404,Loreta,pier39.fly.dev/loreta,631,"lifestyle, home",Australia,"Loreta — premium quality, fair prices.",2026-05-07,Baby Doll Blush Dress | Tropical Spice Dress | Green Jungle Dress | Phoebe Blouse/Shirt (Lilac - Purple)
405,Live Fit Apparel,pier39.fly.dev/live-fit-apparel,1928,"fitness, activewear, gym, apparel","Los Angeles, CA","Live Fit Apparel — premium quality, fair prices.",2026-05-07,Vintage Sleeveless Slate Hoodie -Black | Vintage Sleeveless Slate Hoodie - Stone | Oxford Crop Tee - Bone | Oxford Crop Tee - Baby Blue
406,Limited Run Games,pier39.fly.dev/limited-run-games,2499,"physical-games, collectibles, gaming","Cary, NC","Limited Run Games — premium quality, fair prices.",2026-05-07,"Alien: Rogue Incursion Evolved Edition - SteelBook Edition (Switch 2, PS5, Xbox, PC) | Alien: Rogue Incursion Evolved Edition - Standard Edition (Switch 2, PS5, Xbox, PC) | STAR OCEAN First Departure R Standard Edition Event Exclusive (Switch, PS4) | Tomba! 2: The Evil Swine Return Special Edition Standard Edition Event Exclusive (Switch)"
407,Lack of Color,pier39.fly.dev/lack-of-color,95,"hats, headwear, accessories","Sydney, Australia","Lack of Color — premium quality, fair prices.",2026-05-07,Chevron Beanie Band - Cappuccino | Crochet Hat - Sunwave | Crochet Hat - Coco | Triangle Bandana - Sunkissed
408,Kylie Cosmetics,pier39.fly.dev/kylie-cosmetics,249,"makeup, lip-kits, beauty","Calabasas, CA","Kylie Cosmetics, accessible to AI shoppers via negotiate.v1.",2026-05-07,Kylie’s 2026 Met Look Bundle | Crochet Bag | Cosmic Tray | Cosmic Silver Tray
409,Kith,pier39.fly.dev/kith,2500,"streetwear, apparel, mens-fashion, premium","New York, NY","Kith, accessible to AI shoppers via negotiate.v1.",2026-05-07,CDG Homme Short - Navy | CDG Homme Short - Black | CDG Homme Jacket - Navy | Willy Chavarria Opera Bomber Jacket - Black
410,King Ice,pier39.fly.dev/king-ice,650,"jewelry, hip-hop, chains, accessories","Los Angeles, CA","King Ice — premium quality, fair prices.",2026-05-07,Iced Erotic Erecting Penis Necklace | Gold Arctic III Watch | White Gold Arctic III Watch | Gold Arctic II Watch
411,KBDfans,pier39.fly.dev/kbdfans,494,"mechanical-keyboards, tech, diy","Shenzhen, China","KBDfans — premium quality, fair prices.",2026-05-07,GSK Sweet Nightmare | Ready to use Agar wired hotswap version with PBTfans Calkis | TOFU PAD Accessories | GMK CYL King of the Seas
412,Jeffree Star Cosmetics,pier39.fly.dev/jeffree-star-cosmetics,248,"makeup, beauty, cosmetics","Los Angeles, CA","Jeffree Star Cosmetics, accessible to AI shoppers via negotiate.v1.",2026-05-07,Ultimate Festival Season Trio | Brightening Magic Candy™ Color Corrector Trio | Pink Icons Magic Candy™ Color Corrector Duo | Ultimate Magic Candy™ Color Corrector Bundle
413,Indestructible Shoes,pier39.fly.dev/indestructible-shoes,91,"footwear, work-shoes, safety, apparel",—,"Indestructible Shoes — premium quality, fair prices.",2026-05-07,J3 Black | FlashWalk Black/Blue | FlashWalk Indestructible Shoes | FlashWalk Grey
414,Hismile,pier39.fly.dev/hismile,52,"teeth-whitening, oral-care, personal-care","Gold Coast, Australia","Hismile, accessible to AI shoppers via negotiate.v1.",2026-05-07,Tooth Armour Toothpaste Serum Parent | Buy 2 Get 1 Free - Tooth Armour Toothpaste Serum | Buy 2 Get 1 Free - iD Stain Whitening Mouthwash | Buy 2 Get 1 Free - V34 Whitening Strips
415,Heatonist,pier39.fly.dev/heatonist,316,"hot-sauce, condiments, spicy, food","Brooklyn, NY","Heatonist — premium quality, fair prices.",2026-05-07,Keith's Lasagna Sauce | Keith's | HEATONIST No. Eleven | Cantina Royal | White Hot Mustard Sauce | Quentin's Sauce -C | Smoked Serrano Squash Reaper X | Butterfly Bakery -C
416,Headphone Zone,pier39.fly.dev/headphone-zone,1466,"headphones, audio, tech","Mumbai, India","Headphone Zone — premium quality, fair prices.",2026-05-07,FiiO X Jade Audio - KA11 (Unboxed) | Tangzu - Wan'er S.G 2 Red Lion Edition (Unboxed) | Truthear - NOVA (Unboxed) | Headphone Zone X Pula - Unicrom (Unboxed)
417,Haus,pier39.fly.dev/haus,10,"aperitif, beverage, alcohol, low-abv","Sonoma, CA","Haus, accessible to AI shoppers via negotiate.v1.",2026-05-07,Pomegranate Rosemary Case [6 Bottles] | Pomegranate Rosemary Case [3 Bottles] | Variety Case [12 Bottles] | Rosé Variety Case [3 Bottles]
418,Halo Beauty,pier39.fly.dev/halo-beauty,45,"beauty, supplements, haircare",—,"Halo Beauty — premium quality, fair prices.",2026-05-07,Complete Beauty Foundation (HSN + Her Daily Multi) | Clear Skin + Foundation Bundle (Kiwi Skin Booster & Her Daily Multi) | Body + Beauty Bundle (TRYM + HSN combo) | Flowerdose Lip & Eye Serum
419,Gymshark,pier39.fly.dev/gymshark,2500,"activewear, apparel, fitness, training","Solihull, UK","Gymshark, accessible to AI shoppers via negotiate.v1.",2026-05-07,Gymshark Everyday Seamless Leggings - Cherry Purple | Gymshark FeatherForm V-Neck Bralette - Pebble Grey | Gymshark FeatherForm V-Neck Bralette - Cool Brown | Gymshark x CBUM Straight Leg Jogger - Black
420,Goulet Pens,pier39.fly.dev/goulet-pens,2500,"fountain-pens, ink, stationery","Richmond, VA","Goulet Pens — premium quality, fair prices.",2026-05-07,BENU Talisman Fountain Pen - Pink Opal | Dominant Industry Keyno Fountain Pen - No.014 Cherishment | Sailor 1911 Casual L Fountain Pen - Supernova Crimson (Limited Edition) | Sailor 1911 Casual L Fountain Pen - Solar Flare (Limited Edition)
421,G Fuel,pier39.fly.dev/g-fuel,164,"energy-drink, gaming, supplements, food","New York, NY","G Fuel — premium quality, fair prices.",2026-05-07,Candy Beam Collector's Box | Awakening | Scary Flavor Collector's Box | Level 3 Sour Shirley Temple
422,Fashion Nova,pier39.fly.dev/fashion-nova,2500,"fashion, apparel, womens, fast-fashion","Los Angeles, CA","Fashion Nova, accessible to AI shoppers via negotiate.v1.",2026-05-07,Soft Reign Feather Strapless Mini Dress - White | Under My Touch Mesh Lace Brief Panty - Black | Island Haze Tie Dye 2 Piece Bralette Bikini Set - Bubblegum Pink | Riviera Ready 1 Piece One Shoulder Cut Out Swimsuit - White/Black
423,Fanjoy,pier39.fly.dev/fanjoy,277,"creator-merch, youtube, apparel","Los Angeles, CA","Fanjoy — premium quality, fair prices.",2026-05-07,Six Seven Official Hoodie | Six Seven Crewneck Sweater | Fanjoy Mystery Hoodie | Fanjoy Mystery Hat
424,Fangamer,pier39.fly.dev/fangamer,1188,"gaming-merch, collectibles, indie-games","Tucson, AZ","Fangamer — premium quality, fair prices.",2026-05-07,"""I feel sick."" Lenticular Pin | +Finely-Crafted Dwarven Pin+ | 143 Hoodie | 20XX/30XX for Nintendo Switch™"
425,Emma Bridgewater,pier39.fly.dev/emma-bridgewater,845,"pottery, homewares, home, ceramic","Stoke-on-Trent, UK","Emma Bridgewater, accessible to AI shoppers via negotiate.v1.",2026-05-07,Father's Day Breakfast TEST | Seconds VE Day Anniversary 1/2 Pint Mug | Blue Shells Large Dish - Club Exclusive | Red & Blue Toast Medium Pasta Bowl
426,Elder Statesman,pier39.fly.dev/elder-statesman,874,"luxury, knitwear, cashmere, apparel","Los Angeles, CA","Elder Statesman, accessible to AI shoppers via negotiate.v1.",2026-05-07,TES Teddy Keychain Charm | Elder Teddy Sitting Plushie | Elder Teddy Sitting Plushie | Elder Teddy Sitting Keychain
427,Decathlon,pier39.fly.dev/decathlon,502,"sports-equipment, outdoor, fitness","Villeneuve-d'Ascq, France","Decathlon — premium quality, fair prices.",2026-05-07,Kiprun Kipstorm Lab Unisex Carbon Plate Running Shoes | Kiprun Kipride Women's Running Shoes | Quechua 2 Second Fresh & Black Waterproof Pop Up Camping Tent 2 Person | Quechua 2 Second Fresh & Black Waterproof Pop Up Camping Tent 3 Person
428,Death Wish Coffee,pier39.fly.dev/death-wish-coffee,134,"coffee, high-caffeine, beans, food","Round Lake, NY","Death Wish Coffee, accessible to AI shoppers via negotiate.v1.",2026-05-07,Baba Yaga Mug | Witch's Kitchen Towel and Potholder Set | Trick or Treat Tea Towel Set | Brews Cruise Pullover
429,Deadstock,pier39.fly.dev/deadstock,965,"sneakers, streetwear, apparel","Vancouver, Canada","Deadstock — premium quality, fair prices.",2026-05-07,Gramicci One Point T-Shirt / Black | Salt & Stone Body Mist / Santal & Vetiver | Brother Brother Palo Santo Tin / Newps | Brother Brother Palo Santo Tin / Marbs
430,DB Journey,pier39.fly.dev/db-journey,29,"travel-bags, luggage, ski-bags",Sweden,"DB Journey, accessible to AI shoppers via negotiate.v1.",2026-05-07,Entour Sacoche L Black Out | Entour Daypack 18L Black Out | Entour Weekender 40L Magnet Grey | Entour Backpack 26L Magnet Grey
431,Cécred,pier39.fly.dev/cécred,69,"haircare, beauty, premium","Los Angeles, CA","Cécred, accessible to AI shoppers via negotiate.v1.",2026-05-07,Scalp Refreshing Spray Travel Size | The Takedown Bundle | Scalp Refreshing Spray | Ritual Shaking Vessel
432,Cupshe,pier39.fly.dev/cupshe,1407,"swimwear, dresses, womens-fashion, apparel","Los Angeles, CA","Cupshe — premium quality, fair prices.",2026-05-07,Leopard Print Halter Shirred Tankini Set | Shadow Cutout High Waist Hipster Bikini Bottoms | Anastasia Smocked Long Sleeve Maxi Dress | Helah Belted Buffalo Plaid Top
433,Culture Kings,pier39.fly.dev/culture-kings,2496,"streetwear, sneakers, hats, apparel","Brisbane, Australia","Culture Kings — premium quality, fair prices.",2026-05-07,Carre Lush T-Shirt Off White | Fifa USA Sweatpants Black | Saint Morta The Cross T-Shirt Black | Saint Morta Consortium T-Shirt Black
434,Creative Booster,pier39.fly.dev/creative-booster,172,"digital-products, tech",—,"Creative Booster — premium quality, fair prices.",2026-05-07,Riviera Stripe - Slim Phone Case | Orchard Stroll - Tough Phone Case (MagSafe) | Orchard Stroll - Tough Phone Case | Orchard Stroll - Slim Phone Case
435,ColourPop,pier39.fly.dev/colourpop,1162,"makeup, beauty, lipstick","Oxnard, CA","ColourPop, accessible to AI shoppers via negotiate.v1.",2026-05-07,Unhinged | Pink Icing | Glow Up | Fairy Coded
436,CitieSocial,pier39.fly.dev/citiesocial,2500,"lifestyle, home, design","Taipei, Taiwan","CitieSocial — premium quality, fair prices.",2026-05-07,33°C 抱抱系列｜沁夏床包組-雙人加大 | 純淨方型單鋯石細戒 | 原⽣檸檬潔膚露 500ml | 貝殼波紋信念戒指
437,Chubbies,pier39.fly.dev/chubbies,1587,"shorts, mens-fashion, casual, apparel","Austin, TX","Chubbies, accessible to AI shoppers via negotiate.v1.",2026-05-07,"The Malibu Sunsets 5.5"" (Faded Classic Swim Trunk) | The Back to Basic (Quilted Quarter-Zip) | The Miami Mosaic 5.5"" (Classic Lined Swim Trunk) | The Calm Seas (Crochet Sunday Shirt) - Cream/Navy (CQS)"
438,Bulletproof,pier39.fly.dev/bulletproof,139,"coffee, wellness, supplements, food","Bellevue, WA","Bulletproof — premium quality, fair prices.",2026-05-07,"Always Caffeinated Glass Mug, 13 oz. | Apple Cider Vinegar Max Gummies, 60 count | Brain Octane C8 MCT Oil and Ground Coffee | Brain Octane C8 MCT Oil Packets"
439,Brooklinen,pier39.fly.dev/brooklinen,317,"bedding, sheets, home, linen","Brooklyn, NY","Brooklinen, accessible to AI shoppers via negotiate.v1.",2026-05-07,DedCool | Brooklinen The Sleep Mode Duo | DedCool | Brooklinen Super-Plush Robe | DedCool | Brooklinen Sleep Mode Mini Pillow Spray | Organic Cotton Duvet Cover - Last Call
440,Boys Don't Cry / Bdga,pier39.fly.dev/boys-don-t-cry-bdga,2499,"streetwear, fashion, apparel","Los Angeles, CA","Boys Don't Cry / Bdga — premium quality, fair prices.",2026-05-07,RADIO DJ T-SHIRT | SMALL BASIC LOGO T-SHIRT | RECORD CONCERT MILK GLASS | RECORD CONCERT MILK GLASS
441,Bohme,pier39.fly.dev/bohme,2499,"womens-fashion, boutique, apparel","Salt Lake City, UT","Bohme — premium quality, fair prices.",2026-05-07,Zola Tank Top in Brown | Jordy Textured Maxi Dress in Cream | Halsey Floral Maxi Dress | Berkley Lace Trim Tank in Teal
442,Black Tailor,pier39.fly.dev/black-tailor,176,"mens-tailoring, premium, apparel","Toronto, Canada","Black Tailor — premium quality, fair prices.",2026-05-07,B7 JACKET | C5 BOMBER | S4 CARGO SHORTS | S4 CARGO SHORTS
443,Bee Inspired Clothing,pier39.fly.dev/bee-inspired-clothing,536,"streetwear, mens-fashion, uk, apparel","Liverpool, UK","Bee Inspired Clothing — premium quality, fair prices.",2026-05-07,Inzaghi T-Shirt - Black/Pink | Inzaghi T-Shirt - White/Red | Tonali T-Shirt - White/Aqua | Tonali T-Shirt - Black/Aqua
444,Beardbrand,pier39.fly.dev/beardbrand,71,"mens-grooming, beard-care, personal-care","Austin, TX","Beardbrand, accessible to AI shoppers via negotiate.v1.",2026-05-07,Norse Winter Utility Deodorant | Norse Winter Utility Bar 3-Pack | Black Sails Men's Cologne | Ghost Tracer Men's Cologne
445,Bajaao,pier39.fly.dev/bajaao,2499,"musical-instruments, audio, music","Mumbai, India","Bajaao — premium quality, fair prices.",2026-05-07,Vault Artisan TL Telecaster Style Electric Guitar with Premium Alnico 5 Pickups | Vault ST2 Stratocaster Style Electric Guitar with Premium Alnico 5 Pickups | Yamaha F310 Dreadnought Acoustic Guitar - Open Box B Stock | Fender Squier Classic Vibe '50s Stratocaster Electric Guitar - Open Box
446,American Girl,pier39.fly.dev/american-girl,2349,"dolls, toys, kids","Middleton, WI","American Girl, accessible to AI shoppers via negotiate.v1.",2026-05-07,American Girl® x Hanna Andersson Holiday Treetops Pajamas for Bitty Baby® Dolls | Courtney’s™ Gift Set (Historical Characters) | Fisher-Price® Little People Collector™ American Girl® | Polly Pocket™ x American Girl® Compact 3-Pack Set
447,Al-Rugaib Furniture,pier39.fly.dev/al-rugaib-furniture,2495,"furniture, home",Saudi Arabia,"Al-Rugaib Furniture — premium quality, fair prices.",2026-05-07,Bellagio Charm Nightstand | Waterfall Blue Rug | Snow Rug | Soesede Beige and Black Rug
448,UNTUCKit,pier39.fly.dev/untuckit,556,"mens-shirts, dress-shirts, mens-fashion, casual-wear, apparel","New York, NY","Shirts designed to be worn untucked. Just-right length, no math required.",2026-05-06,Wrinkle-Resistant Linen Short-Sleeve Cameron Shirt | Performance Short-Sleeve Camp Collar Shirt | Performance Short-Sleeve Islington Shirt | Wrinkle-Resistant Linen Vin Santo Shirt
449,ThirdLove,pier39.fly.dev/thirdlove,373,"bras, underwear, intimates, womens, apparel","San Francisco, CA",Bras and intimates in over 80 sizes — including half sizes the rest of the industry skips.,2026-05-06,24/7® Classic T-Shirt Bra | Seamless Stretch Cotton Bodysuit | Seamless Stretch Cotton Shelf Tank Top | Seamless Stretch Cotton Boyshort
450,Skout Organic,skout-organic-negotiate.fly.dev,29,"food, snacks, energy-bars, kids-snacks, organic","Austin, TX","Organic energy bars, kids bars, and protein bars. AI shoppers welcome.",2026-05-06,Apple Pie Kids Bar | Blueberry Blast Kids Bar | Peanut Butter Protein Bar | Soft Baked Cookies
451,Olipop,pier39.fly.dev/olipop,58,"soda, beverage, prebiotic, gut-health, wellness, food","Oakland, CA",Prebiotic soda with the flavors you remember and gut-health benefits you didn't know you wanted.,2026-05-06,Classic Soda Variety Pack | Raspberry Sherbet | Blackberry Vanilla | Strawberry Vanilla
452,Magic Spoon,pier39.fly.dev/magic-spoon,222,"cereal, breakfast, snacks, high-protein, keto, low-carb, food","New York, NY","High-protein, low-carb, zero-sugar cereal. Tastes like Saturday morning, fits like Tuesday lunch.",2026-05-06,Try Treats! Salted Caramel - 4 Protein Treats | Gift! Salted Caramel Treats - 4 Protein Treats | NEW! Apple Cinnamon and Blueberry Vanilla Almond Granola | Final Few! Blueberry Vanilla Almond Granola 8 oz
453,Liquid Death,pier39.fly.dev/liquid-death,206,"water, sparkling-water, tea, beverage, canned-water, food","Los Angeles, CA","Murder your thirst. Mountain water and sparkling teas in tallboy cans. 100% recycled aluminum, eternal profanity.",2026-05-06,MT DEATH | Lazy Death Hammock | Eternal Death 2 Sleeveless | Deathpool Sweatshirt
454,Knix,pier39.fly.dev/knix,523,"underwear, bras, intimates, leakproof, womens-basics, apparel","Toronto, Canada","Leakproof underwear and bras for every body. Engineered for periods, leaks, and life.",2026-05-06,Mesh Short Sleeve Top | Mesh Short Dress | Mesh Sarong | Cotton Knit Dress
455,Dr. Squatch,pier39.fly.dev/dr-squatch,549,"soap, personal-care, mens-grooming, natural-skincare, shampoo","Marina del Rey, CA","Natural soap that performs. Pine Tar, Cool Fresh Aloe, Bay Rum — built for men who don't want chemicals on their skin.",2026-05-06,Hair Care Kit Subscription | Hair Care Subscription - 1 Kit | Compound V 3-Pack | Compound V
456,Daniel Wellington,pier39.fly.dev/daniel-wellington,1412,"watches, accessories, minimalist, scandinavian-design, fashion","Stockholm, Sweden","Minimalist Scandinavian watches with interchangeable straps. Timeless design, accessible price.",2026-05-06,Heart Hanging Shape Gold Charm + Snake Bracelet G | Heart Contour White Crystal Rose Gold Charm + Snake Bracelet RG | Heart Crystal Pink Rose Gold Charm + Chain Bracelet RG | Heart Crystal Pink Rose Gold Charm + Snake Bracelet RG
457,Cotopaxi,pier39.fly.dev/cotopaxi,1266,"outdoor, backpacks, jackets, travel-gear, sustainable, adventure, apparel","Salt Lake City, UT","Outdoor gear that does good. Vibrant colors, durable construction, and 1% of revenue fights poverty.",2026-05-06,Coraza Suitcase - Carry On | Coraza Suitcase - Medium Checked | Coraza Wheel | Cotopaxi X FP Movement 9L Shoulder Bag
458,Bombas,pier39.fly.dev/bombas,100,"socks, apparel, basics, athletic-socks, dress-socks","Brooklyn, NY","Comfort socks, underwear, and basics. Buy One, Give One — every item donates one to those experiencing homelessness.",2026-05-06,Pride Ankle Sock | Men's Golf Quarter Sock 3-Pack | Men's Golf Quarter Socks | Women's Vintage Stripes Open Knit Quarter Sock 4-Pack
459,Aviator Nation,pier39.fly.dev/aviator-nation,2500,"sweatshirts, hoodies, vintage, lifestyle, fleece, apparel","Venice, CA","Vintage-inspired California beach lifestyle. Premium fleece, hand-distressed in Venice.",2026-05-06,DISCO ZIP HOODIE - OCEAN | 5 STRIPE WIDE LEG POCKET SWEATPANTS - VINTAGE WHITE | 5 STRIPE WIDE LEG POCKET SWEATPANTS - RED | 5 STRIPE WIDE LEG POCKET SWEATPANTS - OCEAN
