#,Name,Domain,Products,Categories,City,Tagline,Added,Sample Products
194,mrcnoir,pier39.fly.dev/mrcnoir,85,general,—,"mrcnoir — premium quality, fair prices.",2026-05-08,'10 Years Tour' Black Tee | Eclipses Black Tee | Bowling Alley Black Tee Shirt | Say No White Tee
195,MMA Warehouse,pier39.fly.dev/mma-warehouse,280,general,—,"MMA Warehouse — premium quality, fair prices.",2026-05-08,YOKKAO 'Sharknado II' Muay Thai Shorts | YOKKAO 'Sharknado II' Muay Thai Gloves | YOKKAO Round Punching Pad | YOKKAO 'Stargame' Short Sleeve Rashguard
196,MMA Silver,pier39.fly.dev/mma-silver,2492,general,—,"MMA Silver — premium quality, fair prices.",2026-05-08,"7"" Stainless Steel 5.5mm Herringbone Bracelet | Adjustable 22"" 18 Karat Gold PVD Stainless Steel Horse Bit Necklace | Adjustable 22"" Stainless Steel Horse Bit Necklace | 6.5"" + 2"" 18 Karat Gold PVD Stainless Steel CZ Curb Chain Bracelet"
197,Mission Workshop,pier39.fly.dev/mission-workshop,154,general,—,"Mission Workshop — premium quality, fair prices.",2026-05-08,"Sector // NEW 5 POCKET PANT | Ocho 19"" | Control + Capsule Pro  [On Presale] | LandSpeeder Tripod Module  [On Presale]"
198,Miracle Noodle,pier39.fly.dev/miracle-noodle,51,general,—,"Miracle Noodle — premium quality, fair prices.",2026-05-08,"6-Pack Ready to Eat Variety Sampler: Angel Hair, Miracle Rice & Fettuccine | 5-Pack Miracle Noodle Fettuccine | The Miracle Living Letter | Miracle Living Book"
199,Mike Amiri,pier39.fly.dev/mike-amiri,1004,general,—,"Mike Amiri — premium quality, fair prices.",2026-05-08,STARS COURT LOW - Black Black | WOMEN - WOMEN'S STARS COURT LOW - Alabaster | MA COURT HI - Black/White | RELAXED PULL ON SWEATSHORT - Black
200,Meowingtons,pier39.fly.dev/meowingtons,342,general,—,"Meowingtons — premium quality, fair prices.",2026-05-08,Kip Cat Bed | Custom World's Best Cat Dad Whiskey Label Cat Mug | Custom Cat Daddies Are The Real Baddies Whiskey Label Cat Mug | Custom Cat Daddies Are The Real Baddies Whiskey Label T-Shirt - Light
201,Maramani,pier39.fly.dev/maramani,462,general,—,"Maramani — premium quality, fair prices.",2026-05-08,"9-Bedroom, Single-Story Multi-Unit Lodge Plan - ID 19908 | Thatched Roof Lodge Design - ID 19907 | Four-Storey 16 Bedroom House Plan - ID 49904 | Stylish 3-Bedroom, 2-Story House Plan - ID 23307"
202,MantraBand,pier39.fly.dev/mantraband,243,general,—,"MantraBand — premium quality, fair prices.",2026-05-08,"A True Friendship Is A Journey Without An End | Those We Love Don’t Go Away, They Walk Beside Us Every Day | She Believed She Could, So She Did | Believe (BOLD)"
203,Mansur Gavriel,pier39.fly.dev/mansur-gavriel,258,general,—,"Mansur Gavriel — premium quality, fair prices.",2026-05-08,Mini Filo Bag - Rainbow | Limited Edition Pascucci Dream Ballerina - Baby Blue Stripe | Limited Edition Pascucci Bag - Limone | Limited Edition Pascucci Bag - Baby Blue Stripe
204,Maker Shed,pier39.fly.dev/maker-shed,900,general,—,"Maker Shed — premium quality, fair prices.",2026-05-08,Greatest Show and Tell Baby Onesie | Greatest Show and Tell Toddler Tee | Bittle Robotic Arm Gripper Extension Kit with Alloy Servos | Robotic Cat Nybble Q Coding Robot Cat | Petoi
205,Mahiya Leather,pier39.fly.dev/mahiya-leather,126,general,—,"Mahiya Leather — premium quality, fair prices.",2026-05-08,Low Rider Organic Tank - Smokey Grey | Celestia Key ring | Wild At Heart Key Ring | Sienna Boho Bag (Fringe Free) - Tan no
206,Mahabis,pier39.fly.dev/mahabis,166,general,—,"Mahabis — premium quality, fair prices.",2026-05-08,mahabis women's aurora in teal quilt | Tova Sandals in Black | Tova Sandals in Ruby | Tova Sandals in Amber
207,Luxy Hair,pier39.fly.dev/luxy-hair,941,general,—,"Luxy Hair — premium quality, fair prices.",2026-05-08,"24"" Seamless Dimensional Rooted Light Bronde Clip-Ins (240g) | 20"" Classic Chestnut Brown Highlights Clip-Ins (220g) | 20"" Dirty Blonde Highlights Halo® Hair Extensions (180g) | 16"" Dimensional Natural Blonde Scalp Hair Fill-Ins (40g)"
208,Luminous Eshop,pier39.fly.dev/luminous-eshop,55,general,—,"Luminous Eshop — premium quality, fair prices.",2026-05-08,SHARK-650WP Loom Back Contact Solar Panel | System Integrator | CAML 125kW/261kWh All-in-One BESS for C&I Applications | Loom Solar SHARK 625 Wp N-Type TOPCon G12R Dual Glass Bifacial Solar Panel(Pack of 36)
209,Lumee,pier39.fly.dev/lumee,1058,general,—,"Lumee — premium quality, fair prices.",2026-05-08,The Tote Duo- Soap Bubble Jelly Tote + Emerald Blue Soap Bubble Jelly Tote | The Jelly Duo - Midnight Black | The Tote Duo - Navy Gingham & Cherry Gingham | The Jelly Duo - Carolina Blue
210,LSPACE,pier39.fly.dev/lspace,799,general,—,"LSPACE — premium quality, fair prices.",2026-05-08,Juno One Piece Swimsuit - Black | Holiday Gift Box Set - Green | Coco One Piece Swimsuit - Midnight Blue | Samba Bikini Top - Lipstick Red
211,Lovepop,pier39.fly.dev/lovepop,2500,general,—,"Lovepop — premium quality, fair prices.",2026-05-08,Vibrant Garden Blooms Breakup Pop-Up Card and Playful Confetti Sentiment Set | Our Story Mother’s Day Petal Pressed™ Bookmark Card and Vintage Sketch Garden Sentiment Set for Mom | Our Story Mother’s Day Petal Pressed™ Bookmark Card and Layered Leaf Harmony Sentiment Set for Mom | Our Story Mother’s Day Petal Pressed™ Bookmark Card and Golden Wildflower Frame Sentiment Set for Mom
212,Love Your Melon,pier39.fly.dev/love-your-melon,26,general,—,"Love Your Melon — premium quality, fair prices.",2026-05-08,Monochrome Essentials Pom Beanies | Monochrome Essential Double Pom Beanies | Monochrome Classic Double Pom Beanies | Monochrome Classic Pom Beanies
213,Lord Timepieces,pier39.fly.dev/lord-timepieces,104,general,—,"Lord Timepieces — premium quality, fair prices.",2026-05-08,22mm Silver Link | Bolt White Silver | Apex Horizon | Apex Racing Red
214,Livestock,pier39.fly.dev/livestock,963,general,—,"Livestock — premium quality, fair prices.",2026-05-08,Tabi Sandal / Off White | COMME des GARÇONS PARFUM x Monocle Scent 4 Yoyogi / 50ml | Nike Air Max 95 OG White / Emerald Green - Lake Blue | Gramicci One Point T-Shirt / Black
215,Lila Nikole,pier39.fly.dev/lila-nikole,192,general,—,"Lila Nikole — premium quality, fair prices.",2026-05-08,Two Day shipping charge | Anacaona Large Feathers | Anacaona Tshirt Set | Anacaona Feather Head piece
216,LIFX,pier39.fly.dev/lifx,67,general,—,"LIFX — premium quality, fair prices.",2026-05-08,LIFX SuperColor A21 + Industrial Cube Base Bundle | LIFX SuperColor A19 + Industrial Cube Base Bundle | Industrial Ceiling Pendant (Black) | Industrial Plug-in or Hardwired Pendant (Gold)
217,LA Girl Cosmetics,pier39.fly.dev/la-girl-cosmetics,191,general,—,"LA Girl Cosmetics — premium quality, fair prices.",2026-05-08,Pinch Perfect Liquid Blush | Blurry Babe Lip Color | Oh So Shiny Nail Fx | Shine On Glossy Balm + Ultimate Intense Stay Auto Lipliner (GLC907 + GP397)
218,La Garconne,pier39.fly.dev/la-garconne,2500,general,—,"La Garconne — premium quality, fair prices.",2026-05-08,Silk Cotton Chino Wide Trousers | Classic Collar Shirt | No.213 Indigo Palaka Denim Jacket | Vintage Cotton T-Shirt — Black
219,La Colombe Coffee,pier39.fly.dev/la-colombe-coffee,56,general,—,"La Colombe Coffee — premium quality, fair prices.",2026-05-08,Salted Caramel Fridge Pack | Colombia - Inga Red Honey | S'mores Draft Latte | Draft Latte Gift Subscription
220,Kulani Kinis,pier39.fly.dev/kulani-kinis,941,general,—,"Kulani Kinis — premium quality, fair prices.",2026-05-08,Scrunchie - Summer Daydreams | Men's Swim Trunks - Summer Daydreams | Minimal Full Coverage Bikini Bottom - Summer Daydreams | Cheeky V Bikini Bottom - Summer Daydreams
221,Kookai,pier39.fly.dev/kookai,1201,general,—,"Kookai — premium quality, fair prices.",2026-05-08,Aspen Fur Jacket | Aspen Fur Jacket | Dylan Suede Core Jacket | Azra Top
222,kokopiecoco,pier39.fly.dev/kokopiecoco,42,general,—,"kokopiecoco — premium quality, fair prices.",2026-05-08,Pink &amp; Black Swirl Platform Ankle Boots – Retro Punk Chunky Heel Boots | Pink Velvet Platform Ankle Boots – Studded Gothic Lace-Up Chunky Heels | Black Micro Mini Skirt – Ultra Short High Waist A-Line Skirt | Black Gothic Lace Corset Mini Skirt – High Waist Ruffle A-Line Skirt
223,Klean Kanteen,pier39.fly.dev/klean-kanteen,127,general,—,"Klean Kanteen — premium quality, fair prices.",2026-05-08,Bring Your Own Party Kit - Pints and Tumblers | Donate to The Conservation Alliance | Bring Your Own Party Kit - Tumblers and Cocktails | 20oz Rise Classic - May The 4th
224,Kingpin cooling,pier39.fly.dev/kingpin-cooling,4,general,—,"Kingpin cooling — premium quality, fair prices.",2026-05-08,KPx High Performance Thermal Paste 1 Gram | KPx High Performance Thermal Paste 3G | KPx High Performance Thermal Paste 30G | KPx High Performance Thermal Paste 10G
225,Killstar,pier39.fly.dev/killstar,1248,general,—,"Killstar — premium quality, fair prices.",2026-05-08,Izora Ribbed Top [PUMPKIN] | Mortaveil Maxi Dress | Midnight Moth Robe | Vile Vixen Flares [Red]
226,Kikkerland,pier39.fly.dev/kikkerland,1119,general,—,"Kikkerland — premium quality, fair prices.",2026-05-08,Parakeet 3D Puzzle | Owl 3D Puzzle | Robin 3D Puzzle | Kiko Catnip Bubbles
227,Kidrobot,pier39.fly.dev/kidrobot,1193,general,—,"Kidrobot — premium quality, fair prices.",2026-05-08,"The Rolling Stones 8"" ICON Dunny - Some Girls | Amber Dunny 8"" Resin Art Figure (PRE-ORDER) | Disney’s Kim Possible - Kim and Shego Phunny Plush Bundle (PRE-ORDER) | Disney's Kim Possible - Shego Phunny Plush (PRE-ORDER)"
228,Key Smart,pier39.fly.dev/key-smart,91,general,—,"Key Smart — premium quality, fair prices.",2026-05-08,21 Bag - Rain Cover | KeySmart® Flex | World's 1st Compact Key Organizer | Holds Up to 8 Keys | SmartCard Ghost (Gen 3) | Works With Apple Find My & Android Find Hub  | Wireless Charging | SmartCard (Gen 2) | Works With Apple Find My App | Wireless Charging
229,Kaged Muscle,pier39.fly.dev/kaged-muscle,61,general,—,"Kaged Muscle — premium quality, fair prices.",2026-05-08,Hydra-Charge | Starter Stack | Daily Wellness Stack | Essential Performance Stack
230,Juvia's Place,pier39.fly.dev/juvia-s-place,180,general,—,"Juvia's Place — premium quality, fair prices.",2026-05-08,Mother's Day Mystery Box | Blushed Blonzing Stick | Blushed Liquid Tint | Blushed and Bronzed Blurring pro palettes
231,Jura Watches,pier39.fly.dev/jura-watches,2476,general,—,"Jura Watches — premium quality, fair prices.",2026-05-08,Garmin Strap QuickFit 22 Black Leather | Garmin Strap QuickFit 22 Red Jacquard Weave | Garmin Strap QuickFit 26 Heathered Red Nylon | Garmin Strap QuickFit 22 Amp Yellow Silicone
232,Joyrich,pier39.fly.dev/joyrich,25,general,—,"Joyrich — premium quality, fair prices.",2026-05-08,WILDSTYLE BRAND LOGO HEADBAND | WILDSTYLE BRAND LOGO HEADBAND | HARD SHELL CARRY-ON LUGGAGE 18.5”X16”X11” - LOGO TEDDY BEAR | PVC PURSE – TEDDY BEAR 11”X9.5”
233,Jouer Cosmetics,pier39.fly.dev/jouer-cosmetics,109,general,—,"Jouer Cosmetics — premium quality, fair prices.",2026-05-08,Long-Wear Lip Liner | Essential Lip Enhancer Shine Balm | Crème Eyeshadow Crayon | Blush Bouquet Dual Palette
234,JOLYN,pier39.fly.dev/jolyn,2312,general,—,"JOLYN — premium quality, fair prices.",2026-05-08,Triangle Bikini Top - Lime | Perry One Piece Swimsuit - Solar Plum Contrast | Perry One Piece Swimsuit - Sky Blue Contrast | Perry One Piece Swimsuit - Pink Prism Contrast
235,Johnny Shades,pier39.fly.dev/johnny-shades,108,general,—,"Johnny Shades — premium quality, fair prices.",2026-05-08,NEW YORK | OCTANE - Polarized | FAIRE | REVER - HD POLARIZED
236,Johnny Cupcakes,pier39.fly.dev/johnny-cupcakes,1276,general,—,"Johnny Cupcakes — premium quality, fair prices.",2026-05-08,Kids Baby Yodel Short Sleeve Premium Tee | Men's Baby Yodel Short Sleeve Premium Tee | Women's Baby Yodel Short Sleeve Premium Tee | Women's Boxy Baby Yodel Short Sleeve Premium Tee
237,John Elliott,pier39.fly.dev/john-elliott,245,general,—,"John Elliott — premium quality, fair prices.",2026-05-08,Summer Reversed Cropped Tee / Big Jim | Big Jim / Falcon | Big Jim / Arizona Blue | Big Jim Boot Stomp Selvedge / Avalon
238,JLab,pier39.fly.dev/jlab,339,general,—,"JLab — premium quality, fair prices.",2026-05-08,JBuds Pods ANC True Wireless Earbuds Black | JBuds Pods ANC True Wireless Earbuds Mauve | JBuds Pods ANC True Wireless Earbuds Blue | GO Work Wireless On-Ear Headset Gen 3 Black
239,Jerry of the Day,pier39.fly.dev/jerry-of-the-day,169,general,—,"Jerry of the Day — premium quality, fair prices.",2026-05-08,Jerry Trapper Turbo Fleece Respect the Send Hat | FOMO Tee Shirt | Sender's Best Friend Tee Shirt | Send-O-Vision 8.0 The Sunsetter
240,Iron and Resin,pier39.fly.dev/iron-and-resin,2499,general,—,"Iron and Resin — premium quality, fair prices.",2026-05-08,Good Luck Diner Mug | Field Denim Shirt - 1st Gen | Harbor Hoodie | Cruiser Jacket - Halley Stevenson
241,INTO THE AM,pier39.fly.dev/into-the-am,295,general,—,"INTO THE AM — premium quality, fair prices.",2026-05-08,Galactic Return Tee | Sea Petals Tee | Dripping World Tee | Deep Siege Tee
242,Intelligent Change,pier39.fly.dev/intelligent-change,164,general,—,"Intelligent Change — premium quality, fair prices.",2026-05-08,Life Designer Journal for Couples (Downloadable) | The Five Minute Journal for Mothers | Get Closer Conversation Game Collection | Get Closer: No Filter Bundle
243,Instant Adcopy,pier39.fly.dev/instant-adcopy,116,general,—,"Instant Adcopy — premium quality, fair prices.",2026-05-08,Buy TikTok | TikTok Influencer Booster | 1 Post Sample Boost | TikTok Influencer Booster | 30 Posts Per Month | TikTok Influencer Booster | 10 Posts Per Month
244,Incu,pier39.fly.dev/incu,2500,general,—,"Incu — premium quality, fair prices.",2026-05-08,Acne Studios 2006F Light Blue Vintage | Every Shirt | Tide Chino | Forever Shirt
245,iHeartRaves,pier39.fly.dev/iheartraves,789,general,—,"iHeartRaves — premium quality, fair prices.",2026-05-08,Lucid Lava Hi-Cut Booty Shorts | Lucid Lava Micro Bikini Top | Lucid Lava Ultra Crop Top | Shroom Bloom UV Reactive Skirt
246,Gul Ahmed,pier39.fly.dev/gul-ahmed,2500,general,—,"Gul Ahmed — premium quality, fair prices.",2026-05-08,Amber Brown T-150 Deck Cushion Cover | 3 Piece Embroidered Cotton Silk Suit with Embroidered Chiffon Dupatta | 3 Piece Printed Lawn suit with Embroidered Denting Lawn Dupatta | Beige Cross Body Bag IBS-CBB26-007
247,Grunt Style,pier39.fly.dev/grunt-style,859,general,—,"Grunt Style — premium quality, fair prices.",2026-05-08,Superior Firepower T-Shirt - Black | FAFO Starship Sticker | Donation to Grunt Style Foundation ($.01) | Death To Tyrants Patch
248,Grey Haze,pier39.fly.dev/grey-haze,2312,general,—,"Grey Haze — premium quality, fair prices.",2026-05-08,Fizzy Cherry Nic Salt by Elf Bar ElfLiq | Mr Blue Nic Salt by Elf Bar ElfLiq | Blueberry Cherry Cranberry Nic Salt by Elf Bar ElfLiq | Strawberry Razz Lemonade Nic Salt by Elf Bar ElfLiq
249,Good American,pier39.fly.dev/good-american,886,general,—,"Good American — premium quality, fair prices.",2026-05-08,THE GARDEN DRESS | CHECKERED RED | THE ANCHOR TOP | WHITE | THE GARDEN DRESS | SHORE BLUE PLAID | STRIPE SEERSUCKER PULL ON  SHORTS | HORIZON GINGHAM SMALL
250,Goatcase,pier39.fly.dev/goatcase,4,general,—,"Goatcase — premium quality, fair prices.",2026-05-08,Neon Fitness | Train Insane | Running Shoe | Flexi Pattern Case
251,Glow Recipe,pier39.fly.dev/glow-recipe,124,general,—,"Glow Recipe — premium quality, fair prices.",2026-05-08,Glow Hues Duo | Gift Card | The Glass Skin Roll Bag Kit | Antisocial Dry Hair Mask
252,Ghospell,pier39.fly.dev/ghospell,115,general,—,"Ghospell — premium quality, fair prices.",2026-05-08,Max PU Jacket | Gabriella Mini Dress | Lizzie Buttoned Shirt | Gwyn Shirt
253,gc2b,pier39.fly.dev/gc2b,103,general,—,"gc2b — premium quality, fair prices.",2026-05-08,2b Luxe Nude No. 5 Racerback | 2b Luxe Nude No. 4 Racerback | 2b Luxe Nude No. 3 Racerback | 2b Luxe Nude No. 2 Racerback
254,G59 Records,pier39.fly.dev/g59-records,50,general,—,"G59 Records — premium quality, fair prices.",2026-05-08,G59 REVIVED TOUR TEE MASK (MULTI) | G59 DUCT TAPE SWEATS (BLACK) | G59 DUCT TAPE REVIVED FLANNEL (MULTI) | G59 HAND DRAWN TEE (WHITE)
255,G Pen,pier39.fly.dev/g-pen,123,general,—,"G Pen — premium quality, fair prices.",2026-05-08,Dr. Greenthumb's X G Pen Dash Mouthpiece | G Pen Hyer Vaporizer | Dab Essential Bundle | Ultimate DGT Bundle
256,FYF,pier39.fly.dev/fyf,1,general,—,"FYF — premium quality, fair prices.",2026-05-08,FYF™
257,FUCKTHEPOPULATION,pier39.fly.dev/fuckthepopulation,161,general,—,"FUCKTHEPOPULATION — premium quality, fair prices.",2026-05-08,GHOSTFACE MASK TEE | GHOSTFACE LOGO TEE | BILLBOARD TEE(WHITE) | BILLBOARD TEE(BLACK)
258,Fucking Awesome,pier39.fly.dev/fucking-awesome,553,general,—,"Fucking Awesome — premium quality, fair prices.",2026-05-08,Hockey Tear MOB Griptape | Embrace Rug | STINGERS Hardcover Book | Stingers Stinger Bag
259,Frankies Bikinis,pier39.fly.dev/frankies-bikinis,2499,general,—,"Frankies Bikinis — premium quality, fair prices.",2026-05-08,Nick Triangle Bikini Top - Michigan at Twilight | Mackenzie Cheeky Bikini Bottom - Michigan at Twilight | x JENNIE Nick Triangle Bikini Top - Heaven Crochet | x JENNIE Nari Crochet Tankini - Ivory Crochet
260,Foreverspin,pier39.fly.dev/foreverspin,57,general,—,"Foreverspin — premium quality, fair prices.",2026-05-08,Ingotstand Mokume-Gane Red-Gold | Ingotstand Founder's Titanium | Ingotstand Tungsten | Tungsten
261,Flatspot,pier39.fly.dev/flatspot,2500,general,—,"Flatspot — premium quality, fair prices.",2026-05-08,Paradise NYC With You Always T-Shirt - Off White | Paradise NYC Smokin Paradise T-Shirt - Vintage Black | Paradise NYC Purradise T-Shirt - Vintage Black | Paradise NYC Purradise T-Shirt - Off White
262,Flare Audio,pier39.fly.dev/flare-audio,53,general,—,"Flare Audio — premium quality, fair prices.",2026-05-08,Attenuate™ | Sound Blocking Bundle | Attenuator Bundle | Calmer® Earphone
263,Feature,pier39.fly.dev/feature,2500,general,—,"Feature — premium quality, fair prices.",2026-05-08,Color Camo Shark Mini Bag - Purple | Kids BAPE Milo Assorted Daypack - Multi | Color Camo Shark Mini Bag - Red | Color Camo Shark Mini Bag - Navy
264,Fear of God,pier39.fly.dev/fear-of-god,941,general,—,"Fear of God — premium quality, fair prices.",2026-05-08,Athletics III Basketball | DSYF Tee | Liberation Now Tee | Liberation Now Tee
265,FCPEffects,pier39.fly.dev/fcpeffects,83,general,—,"FCPEffects — premium quality, fair prices.",2026-05-08,Organic Light Leaks | Better Black & White | Lens Flare Plugin | Gift Voucher
266,Fayettechill,pier39.fly.dev/fayettechill,212,general,—,"Fayettechill — premium quality, fair prices.",2026-05-08,M's Norfork Short | Limestone Lookout - SS | Postcard - SS | Lagoon - SS
267,FasciaBlaster,pier39.fly.dev/fasciablaster,175,general,—,"FasciaBlaster — premium quality, fair prices.",2026-05-08,Nexcia Basix Fascia Care Kit Bundle | The Nexcia Luxe Kit Bundle | Nexcia Expansion Kit | Blaster Oil Essentials 3 Pack
268,Extra Butter,pier39.fly.dev/extra-butter,2500,general,—,"Extra Butter — premium quality, fair prices.",2026-05-08,Patta Mens Laserprint Whiskers Denim Pants | By Parra Mens What Is This Tee | By Parra Mens Special Books Tee | Salomon Mens XT-6 Shoes
269,Export Leftovers,pier39.fly.dev/export-leftovers,2500,general,—,"Export Leftovers — premium quality, fair prices.",2026-05-08,Max 21 Men's Great Wave Oversized Tee Shirt | Max 21 Men's Pleated Trousers | Polo Republica Men's Color-Block Minor Fault Polo Shirt | Men's Camrose Minor Fault Crew Neck Sweat Shirt
270,Evannex,pier39.fly.dev/evannex,2246,general,—,"Evannex — premium quality, fair prices.",2026-05-08,Model 3 Lower Control Arm Kit - 4 Piece Kit Without Hardware | PASSENDER SIDE 20X9.0 SINGLE WHEEL REPLACEMENT | Genuine Chevrolet Premium Carpeted Floor Mats with Bolt EV Logo for Chevrolet Bolt | Front and Rear Sway Bar Kit Tesla Model Y Long Range and Performance Dual Motor 2020-2024
271,Essence Makeup,pier39.fly.dev/essence-makeup,200,general,—,"Essence Makeup — premium quality, fair prices.",2026-05-08,mystery box makeup set | The super peptide glossy lip butter set | POPCORN BOMB shiny lipgloss | EVERYBUNNY needs SOMEBUNNY lip balm
272,Emoji Island,pier39.fly.dev/emoji-island,584,general,—,"Emoji Island — premium quality, fair prices.",2026-05-08,Smile Emoji | Kiss Emoji | Foot Emoji | Index Finger Emoji
273,Emily McDowell,pier39.fly.dev/emily-mcdowell,230,general,—,"Emily McDowell — premium quality, fair prices.",2026-05-08,Swans Love Card | Flamingo Friendship Card | Hummingbird Empathy Card | Canary Birthday Card
274,Elwood Clothing,pier39.fly.dev/elwood-clothing,177,general,—,"Elwood Clothing — premium quality, fair prices.",2026-05-08,OLYMPIC NYLON SHORT | OLYMPIC NYLON SHORT | OLYMPIC NYLON SHORT | MUSCLE TANK
275,eLiquid,pier39.fly.dev/eliquid,2497,general,—,"eLiquid — premium quality, fair prices.",2026-05-08,Halo Triton II Replacement Coils | Halo Triton II Tank | Veepon Tita RBA Tank Section | Veepon Tita AIO Spare Tank
276,Elemental Knives,pier39.fly.dev/elemental-knives,70,general,—,"Elemental Knives — premium quality, fair prices.",2026-05-08,Damascus Steel M9 Bayonet | Slaughter Karambit 1 | Hyper Beast© T-Shirt | Random Battle Scarred Small Knife
277,eJuices Co,pier39.fly.dev/ejuices-co,2434,general,—,"eJuices Co — premium quality, fair prices.",2026-05-08,Halo Triton II Replacement Coils | Halo Triton II Tank | Veepon Tita RBA Tank Section | Veepon Tita AIO Spare Tank
278,Edens Garden,pier39.fly.dev/edens-garden,695,general,—,"Edens Garden — premium quality, fair prices.",2026-05-08,Add To Cart Essential Oil Blend- A Refreshing Citrus Punch That Energizes & Keeps You Wanting More | Summer Limited Edition Blends 3 Set | Wind & Sea Essential Oil Blend- Gives You The Ultimate Smooth Sailing Vibes | Sun-Kissed Linen Essential Oil Blend- A Splash Of Sun & Freshly Laundered Linens Radiate In This Perfect Blend
279,Ebarza,pier39.fly.dev/ebarza,2499,general,—,"Ebarza — premium quality, fair prices.",2026-05-08,AS IS Dark Emperador Rectangular Dining Table JK-W009-ASIS | Ornament Keychain BE-KC7 - Red -02 | Ornament Keychain BE-KC7 - Black -04 | Ornament Keychain BE-KC7 - Yellow -05
280,Drop Dead,pier39.fly.dev/drop-dead,107,general,—,"Drop Dead — premium quality, fair prices.",2026-05-08,Lecter Knit Jumper | Pazuzu Keyring | Flux Ring Set | Severed Scarf
281,Dr.Dabber,pier39.fly.dev/dr-dabber,62,general,—,"Dr.Dabber — premium quality, fair prices.",2026-05-08,Switch²™ JNG Joylink Carb Cap | Switch™ Quartz Induction Cup | Switch™ Marble Carb Cap | Dr. Dabber Ghost²™
282,Dose of Colors,pier39.fly.dev/dose-of-colors,50,general,—,"Dose of Colors — premium quality, fair prices.",2026-05-08,Wooden Lip Liner | Dose Bag | It's Literally Magic Multi-Use Shimmer Stick | You Are Limitless Reusable Tote Bag - Small
283,Dip Your Car,pier39.fly.dev/dip-your-car,2500,general,—,"Dip Your Car — premium quality, fair prices.",2026-05-08,Fire Mist Candy Metallic | Galaxy V1 Flake | Midnight Prism Candy Metallic | Sunfire Gold Candy Metallic
284,Despair,pier39.fly.dev/despair,297,general,—,"Despair — premium quality, fair prices.",2026-05-08,2026 Demotivators® Wall Calendar | Success-Canoe | Scapegoating | Rightsizing
285,Deny Designs,pier39.fly.dev/deny-designs,2500,general,—,"Deny Designs — premium quality, fair prices.",2026-05-08,Jessica Molina Lemon Pattern on Sky Blue Water Bottle | Jessica Molina Lemon Pattern on Sky Blue Rectangular Tray | Jessica Molina Lemon Pattern on Sky Blue Yoga Towel | Jessica Molina Lemon Pattern on Sky Blue Yoga Mat
286,Deering Banjos,pier39.fly.dev/deering-banjos,517,general,—,"Deering Banjos — premium quality, fair prices.",2026-05-08,Clawgrass #2 | Showroom Banjo | Rustic Wreath | Showroom Banjo | Deering Retirement Plan Women’s V-Neck Shirt | Deering Nightime Banjo Button Up Shirt
287,DDP Yoga,pier39.fly.dev/ddp-yoga,196,general,—,"DDP Yoga — premium quality, fair prices.",2026-05-08,Beast Mode 90 | DDPY Unisex U.S. Flag Shirt (On Demand Printing) | Unstoppable 100 Point Club T Shirt | Diamond Instructor Women's Scoop Muscle Tank  (On Demand Printing)
288,Day Designer,pier39.fly.dev/day-designer,118,general,—,"Day Designer — premium quality, fair prices.",2026-05-08,Flagship Mini Bookmark Planner Ruler | A5 Quarterly Planner Inserts: Dated Day on One Page (Q4 2026: October - December 2026) | 2026-27 Daily Planner: Day Lily | 2026-27 Daily Planner: Belle Vie
289,Darn Good Yarn,pier39.fly.dev/darn-good-yarn,1045,general,—,"Darn Good Yarn — premium quality, fair prices.",2026-05-08,Sparkle Me Shawl Kit | Mystery Hank of Banana Fiber Yarn | DK Alpaca & Merino Hand Painted Yarn | Sport Alpaca & Merino Hand Painted Yarn
290,Dagne Dover,pier39.fly.dev/dagne-dover,909,general,—,"Dagne Dover — premium quality, fair prices.",2026-05-08,Extend Protection Plan | Extend Protection Plan | Extend Protection Plan | Extend Protection Plan
291,Crane and Canopy,pier39.fly.dev/crane-and-canopy,2168,general,—,"Crane and Canopy — premium quality, fair prices.",2026-05-08,The Moroccan Bungalow Hand Knotted Wool Rug | The Arden Medallion Tufted Wool Rug | The Belle Tufted Wool Rug | The Tate Geometric Tufted Rug
