#,Name,Domain,Products,Categories,City,Tagline,Added,Sample Products
1,Zelouf International,pier39.fly.dev/zelouf-international,2498,general,—,"Zelouf International — premium quality, fair prices.",2026-06-09,LACE WITH SEQUINS AND PAILLETTES  | 28081 | LUNETTE ABSTRACT PAILLETTES ON LACE  | 28027-LACE | ZIA SATIN SOUTACHE W/ SEQUINS ON LACE  | 27599-LACE | STRIPED SUITING | 061
2,Z Supply,pier39.fly.dev/z-supply,30,general,—,"Z Supply — premium quality, fair prices.",2026-06-09,Linden Slub Rib Maxi Dress | Tourist Polarized Sunglasses | Napa Lightweight Denim Mini Dress | Flared Jumpsuit
3,XYON Health,pier39.fly.dev/xyon-health,58,general,—,"XYON Health — premium quality, fair prices.",2026-06-09,"Oral Finasteride | ClinicConnect™ Business Card – Size: 3.5"" x 2"", Stock: 16pt Glossy Cardstock, Coating: Soft Touch L  (50 units per pack) | SiloxysSystem™ Patient Leaflet – 8.5"" x 11"" Portrait, 100lb Gloss Text, Semi Gloss Coating (50 units per pack) | Women's Brochure Size: 5.8"" x 12.3"" Print: Full Color Both Sides (50 units per pack)"
4,Wisteria,pier39.fly.dev/wisteria,2354,general,—,"Wisteria — premium quality, fair prices.",2026-06-09,Aurevain Wood Side Table | Norelle Wood Dining Table | Aurevain Wood Dining Table | Aurevain Wood Coffee Table
5,Weatherman,pier39.fly.dev/weatherman,55,general,—,"Weatherman — premium quality, fair prices.",2026-06-09,America250 x Folds of Honor Women’s Stride Pullover Poncho | America250 x Folds of Honor Trek All-Weather Hat | America250 x Folds of Honor Men’s Stride Pullover Poncho | Summer Essential Set
6,Voluspa,pier39.fly.dev/voluspa,816,general,—,"Voluspa — premium quality, fair prices.",2026-06-09,Eau De Parfum - Discovery Set | Petal & Pair - Eau De Parfum Duo | Petal and Pair Masterclass Ticket - Print Workshop and Fragrance Masterclass | Burning Woods - Petite Jar Candle
7,Vintner's Daughter,pier39.fly.dev/vintner-s-daughter,19,general,—,"Vintner's Daughter — premium quality, fair prices.",2026-06-09,Active Renewal Cleanser® | Active Renewal Cleanser® 26ml | Active Renewal Cleanser® | Active Treatment Essence® 10ml Travel Size
8,Vidaful,pier39.fly.dev/vidaful,22,general,—,"Vidaful — premium quality, fair prices.",2026-06-09,Zinc | Water of Life | Vida-Biotic | Selenium
9,Verb Products,pier39.fly.dev/verb-products,72,general,—,"Verb Products — premium quality, fair prices.",2026-06-09,Verb® Dry Shampoo Powder | Rainbow Tote | Mother of all Bundles | Ghost Icons Kit
10,UrbanStems,pier39.fly.dev/urbanstems,284,general,—,"UrbanStems — premium quality, fair prices.",2026-06-09,The Vibrant Blossom | The First Bloom | The Blushing Beauty | Levain Signature 4 Pack
11,UPTIME Energy,pier39.fly.dev/uptime-energy,17,general,—,"UPTIME Energy — premium quality, fair prices.",2026-06-09,UPTIME ORIGINAL Variety Zero Sugar 12 Pack | UPTIME TROPICAL VARIETY Zero Sugar 12 Pack | Strawberry Dragonfruit Cane Sugar 12 Pack | Tropical Passionfruit Zero Sugar - 12 Pack
12,ULE Group,pier39.fly.dev/ule-group,2213,general,—,"ULE Group — premium quality, fair prices.",2026-06-09,"36 Watt LED HID Replacement; ED28; 5000K; Mogul extended base; 120-277 Volt; Type B Ballast Bypass | Dale - LED Flush with Opal Frosted Glass - Aged Bronze Finish | Beaker - 1 Light Mini Pendant with Clear Glass -Aged Bronze Finish | Two Hole - Long Barrel Compression Lugs, 600 MCM Wire, 1/2"" Bolt Size, Green Color Code"
13,Rokform,pier39.fly.dev/rokform,185,general,—,"Rokform — premium quality, fair prices.",2026-06-09,Google Pixel 11 Pro XL Rugged Case Black | 32GB MicroSDHC Ultra Sandisk Memory Card | Samsung Galaxy Z Fold8 Rugged Case Black | Limited Edition Samsung S26 Ultra Rugged Case in Stars & Stripes
14,Rockstar Original,pier39.fly.dev/rockstar-original,2500,general,—,"Rockstar Original — premium quality, fair prices.",2026-06-09,Forbidden Heather Grey Crop Boxy Polo/Fleece Baggy Track Set | Girls Leslee Black/Pink Boxy T-Shirt Short Set | Boys Leslaw Black/Yellow Boxy T-Shirt Short Set | Boys Teiario Black Rhinestone Track Short
15,River Of Goods,pier39.fly.dev/river-of-goods,580,general,—,"River Of Goods — premium quality, fair prices.",2026-06-09,"42"" W Cecily LED Indoor Amber Swirl Hand-Cut Glass White Ceiling Fan with Remote Control | 42"" W Pierre LED Indoor Blue and Teal Mosaic Glass Ceiling Fan with Remote Control | 42"" W Braxton LED Indoor Clear and Gold Glass Ceiling Fan with Oak/White Blades, Remote Control | 42"" W Valencia LED Indoor Clear Hand-Cut Glass Bowl Shade Ceiling Fan with Remote Control"
16,Revlon,pier39.fly.dev/revlon,144,general,—,"Revlon — premium quality, fair prices.",2026-06-09,Insta-Blush™ Cream Blush Stick | ColorSilk™ After Color Serum | ColorSilk™ After Color Hair Mask | ColorSilk™ After Color Conditioner
17,Reverie,pier39.fly.dev/reverie,40,general,—,"Reverie — premium quality, fair prices.",2026-06-09,Mattress Refresh Upgrade Package | R650™ Adjustable Power Base | Tilt Motor Upgrade Package | Reverie Connect™ Control Box
18,REEF,pier39.fly.dev/reef,1260,general,—,"REEF — premium quality, fair prices.",2026-06-09,Fanning Slide | Fanning Slide | Fanning Slide | Fanning Slide
19,Randys Worldwide,pier39.fly.dev/randys-worldwide,2483,general,—,"Randys Worldwide — premium quality, fair prices.",2026-06-09,"ICON 2014-2026 Ram 2500 4WD, Diesel, Coil Spring Rear, 4.5"" Lift, Stage 5 Suspension System, w/ Performance Rear Coil Springs | ICON 2014-2026 Ram 2500 4WD, Diesel, OEM Air Spring Rear, 4.5"" Lift, Stage 5 Suspension System | ICON 2014-2026 Ram 2500 4WD, Diesel, Coil Spring Rear, 4.5"" Lift, Stage 5 Suspension System | ICON 2014-2026 Ram 2500 4WD, Diesel, Coil Spring Rear, 2.5"" Lift, Stage 5 Suspension System, w/ Performance Rear Coil Springs"
20,Oxyfresh,pier39.fly.dev/oxyfresh,34,general,—,"Oxyfresh — premium quality, fair prices.",2026-06-09,Sample Size Pet Toothpaste - Best Way To Clean Pet Teeth | Pet Dental Water Additive + Stain & Odor Remover | Dog Dental Chew Toy + Pet Dental Gel Toothpaste | Dog Water Additive + Dog Dental Chew Toy
21,Origin Maine,pier39.fly.dev/origin-maine,30,general,—,"Origin Maine — premium quality, fair prices.",2026-06-09,ORIGIN® PERFORMANCE WOOL BOOT SOCK | Burnt End Founder’s Blend Premium Seasoning | ORIGIN® CORE T-SHIRT - 250TH STANDARD ISSUE GRAPHIC | Delta Flex 250 Edition Victory Jeans - Taper
22,Oma's Pride,pier39.fly.dev/oma-s-pride,21,general,—,"Oma's Pride — premium quality, fair prices.",2026-06-09,Whole Necks | Turkey Hearts | Turkey Chunks | Lamb Lung
23,OluKai,pier39.fly.dev/olukai,484,general,—,"OluKai — premium quality, fair prices.",2026-06-09,Mea Ola Nuʻu - Dark Java / Tan | Huia - White Sand / Misty Blue | Hila - Moonlit Ocean | ‘Ohana - Blossom / Lava Rock
24,OLLY,pier39.fly.dev/olly,73,general,—,"OLLY — premium quality, fair prices.",2026-06-09,Comfy Mood + Skin Body Wash | Clear Mood + Skin Body Wash | Happy Mood + Skin Body Wash | Cool Mood + Skin Body Wash
25,Old World Christmas,pier39.fly.dev/old-world-christmas,2366,general,—,"Old World Christmas — premium quality, fair prices.",2026-06-09,Running On Fumes Ornament | Tabletop Metal Tree Display Ornament | Santa With Penguin Pals | LSU  Football Ornament
26,OLAPLEX,pier39.fly.dev/olaplex,369,general,—,"OLAPLEX — premium quality, fair prices.",2026-06-09,PRO EXCLUSIVE: BOND SHAPER CURL REBUILDING TREATMENT™ | PRO EXCLUSIVE: ORIGINAL BOND BUILDING KIT - Travel Size | PRO EXCLUSIVE: ORIGINAL BOND BUILDING KIT | PRO EXCLUSIVE: ORIGINAL BOND BUILDING KIT - Travel Size
27,nyandcompany.com,pier39.fly.dev/nyandcompany-com,2500,general,—,"nyandcompany.com — premium quality, fair prices.",2026-06-09,Plaid A-Line Midi Sundress With Front Tie | Claire Colorblock Midi Sweater Dress | Sleeveless V Neck Bodycon Maxi Dress | V Neck Woven A Line Midi Dress
28,Nike Strength,pier39.fly.dev/nike-strength,88,general,—,"Nike Strength — premium quality, fair prices.",2026-06-09,Nike Flex Lifting Tape | Nike Athletic Tape | Nike Adjustable Dumbbell & Bench Bundle | Free Returns + Package Protection
29,NEST New York,pier39.fly.dev/nest-new-york,343,general,—,"NEST New York — premium quality, fair prices.",2026-06-09,Sunlit Yuzu & Neroli Reed Diffuser & Liquid Refill Set | Build Your Own Set: Liquid Soaps | Moroccan Amber Reed Diffuser & Liquid Refill Set | Best Sellers Body Mist Trio
30,Necessaire,pier39.fly.dev/necessaire,112,general,—,"Necessaire — premium quality, fair prices.",2026-06-09,The Body Wipe + Eucalyptus Water | Eucalyptus Water | The Body Wipe | The Deodorant | Mandelic Acid
31,Nearly Natural,pier39.fly.dev/nearly-natural,2500,general,—,"Nearly Natural — premium quality, fair prices.",2026-06-09,"26” UV Resistant Artificial Flowering Rose Bush with Integrated Ground Stake (Indoor/Outdoor) - Set of 2 | 2' UV Resistant Artificial Red, White and Blue Flowering Daisy Bush with Integrated Ground Stake (Indoor/Outdoor) - Set of 2 | 4’ UV Resistant Artificial Grass Plant in White Decorative Planter (Indoor/Outdoor) | 6’ UV Resistant Artificial Grass Plant in White Decorative Planter (Indoor/Outdoor)"
32,Natural Life,pier39.fly.dev/natural-life,1499,general,—,"Natural Life — premium quality, fair prices.",2026-06-09,Wanderwood Earrings | Applique Hang Around Cotton Tunic - Strong As A Mother | Magnolia Top - Wildflower Medallion Teal | Ana Tote Bag
33,Narrative and Co,pier39.fly.dev/narrative-and-co,425,general,—,"Narrative and Co — premium quality, fair prices.",2026-06-09,The Favorite Skirt | The Side Note Top | The Favorite Classic Embossed Sweatshirt | The Drawn Dress
34,Nahla Madison Home,pier39.fly.dev/nahla-madison-home,2459,general,—,"Nahla Madison Home — premium quality, fair prices.",2026-06-09,Josephine Dining Table | Josephine Side Table | Greggs Drink Table | Granville Counter Stool
35,MZ Wallace,pier39.fly.dev/mz-wallace,560,general,—,"MZ Wallace — premium quality, fair prices.",2026-06-09,Navy Large Zoey Large Zip Pouch | Magnet Zoey Large Zip Pouch | Black Michael Garment Bag | Black Travel Pouch Set
36,Mother Denim,pier39.fly.dev/mother-denim,1026,general,—,"Mother Denim — premium quality, fair prices.",2026-06-09,Eterne Low Rise Lounge Pant - Papaya | Eterne Cropped V Neck Sweatshirt - Fern | Eterne Low Rise Lounge Pant - Fern | The S/S Ruffle Raquette - Pink And Red
37,Montana Knife Company,pier39.fly.dev/montana-knife-company,676,general,—,"Montana Knife Company — premium quality, fair prices.",2026-06-09,MKC HERITAGE TEE - USA MADE - BLACK | MKC HERITAGE TEE - USA MADE - OLIVE | MKC HERITAGE TEE - USA MADE - STONE | MKC HERITAGE TEE - USA MADE - GLACIER
38,Mirai Clinical,pier39.fly.dev/mirai-clinical,35,general,—,"Mirai Clinical — premium quality, fair prices.",2026-06-09,Deodorizing Laundry Detergent Sheets with Japanese Persimmon | Deodorizing Soap Bar and Body Wash | Persimmon Bath Bundle | Airtight Suction Hook
39,Million Dollar Baby,pier39.fly.dev/million-dollar-baby,170,general,—,"Million Dollar Baby — premium quality, fair prices.",2026-06-09,Crawford Recliner and Swivel Glider | Premium 2-Stage Breathable Crib Mattress | Comfort Crib Mattress | Gooselings Seaside Stripes Swaddle - Ocean
40,MESHKI,pier39.fly.dev/meshki,2070,general,—,"MESHKI — premium quality, fair prices.",2026-06-09,Samira Knit Long Sleeve Mini Dress - Light Olive | Sam Halter Hand Crochet Maxi Dress - Ivory | Mollie Mini Dress With Crochet Overlay - Cornflower Blue | Mollie Mini Dress With Crochet Overlay - White & Chocolate
41,Melinda Maria,pier39.fly.dev/melinda-maria,747,general,—,"Melinda Maria — premium quality, fair prices.",2026-06-09,Tessa Necklace 16mm - Silver|Labradorite | Tessa Necklace 16mm - Gold|Labradorite | The David Ring - Silver|Labradorite | The David Ring - Gold|Labradorite
42,melin,pier39.fly.dev/melin,435,general,—,"melin — premium quality, fair prices.",2026-06-09,The Legend Hydro - Northern Aura | Odysea Links Hydro - Sky / Light Grey | Coronado Packable Hydro - Quarry | Odysea Scout Thermal - Caramel
43,Medterra,pier39.fly.dev/medterra,50,general,—,"Medterra — premium quality, fair prices.",2026-06-09,Better Sleep Bundle | Multi-Spectrum CBD Sleep Bundle | Rest & Restore Bundle | Relief Bundle
44,Maxwood Furniture,pier39.fly.dev/maxwood-furniture,872,general,—,"Maxwood Furniture — premium quality, fair prices.",2026-06-09,Pacific Queen Bunk Bed | Pacific King Bunk Bed | Pacific Twin XL Bunk Bed | Pacific Twin XL Bunk Bed with Stairs
45,Mattel,pier39.fly.dev/mattel,2499,general,—,"Mattel — premium quality, fair prices.",2026-06-09,Little People Brinquedo para Bebês Caminhão Escolar Fazendo Novos Amigos | Fisher-Price Baby Brinquedo para Bebês Ginásio de Atividades Musical 3 em 1 | Figura de Ação Disney Pixar Toy Story 5 Woody Vintage de 12 Polegadas | Little People Brinquedo para Bebês Caminhão de Bombeiros Médio
46,Manos Soap,pier39.fly.dev/manos-soap,54,general,—,"Manos Soap — premium quality, fair prices.",2026-06-09,Birthday Party Soap Favors | Bat or Bar Mitzvah Soap Favors | Bridal Shower Soap Favors | Wedding Soap Favors
47,MakerFlo Crafts,pier39.fly.dev/makerflo-crafts,303,general,—,"MakerFlo Crafts — premium quality, fair prices.",2026-06-09,Sublimation Mini Pack | 40oz Electroplated Tumbler with Handle | 20oz Skinny Electroplated with Handle | 20oz Skinny with Handle
48,Madhappy,pier39.fly.dev/madhappy,1079,general,—,"Madhappy — premium quality, fair prices.",2026-06-09,SUPERSHOP Fleece Hoodie | FREECITY Dove Pillow Small | FREECITY Wildflower iPhone Case | FREECITY Dove Pillow Small
49,M.M.LaFleur,pier39.fly.dev/m-m-lafleur,2024,general,—,"M.M.LaFleur — premium quality, fair prices.",2026-06-09,Jax Turtleneck Top - Light Printed Jersey :: Abstract Hydrangea | Choe Top - 365 Stretch Knit :: Bold Check | Axam Layering Turtleneck - Contrast Organic Ribbed Pima Cotton :: Ivory/Red | Nika Summer Friday Top - Printed Voile :: Soft Floral
50,LoveShackFancy,pier39.fly.dev/loveshackfancy,1903,general,—,"LoveShackFancy — premium quality, fair prices.",2026-06-09,BOGNER FIRE+ICE x LoveShackFancy Aneli Hat | Octavia Quilted Bow Print Pouch | STATE x LoveShackFancy Gold Graham XL Tote | Tween Stretch Pointelle Jovie Dress
51,Love Wellness,pier39.fly.dev/love-wellness,71,general,—,"Love Wellness — premium quality, fair prices.",2026-06-09,Tired Mom Bundle | Bloat* Quick Melt Strips - 1 Pack | Cravings* Quick Melt Strips - 1 Pack | Calm* Quick Melt Strips - 1 Pack
52,Lion Brand Yarn Company,pier39.fly.dev/lion-brand-yarn-company,828,general,—,"Lion Brand Yarn Company — premium quality, fair prices.",2026-06-09,Celtic Weave Earwarmer (Crochet) | The Crochet Rose Appliqué (Crochet) | Easy Ripple Stitch Baby Blanket (Crochet) | River Arrow Coaster (Crochet)
53,Legendairy Milk,pier39.fly.dev/legendairy-milk,180,general,—,"Legendairy Milk — premium quality, fair prices.",2026-06-09,Spare Duckbill Valves (1 Month Supply) | Spare Duckbill Valves (6 Month Supply) | Spare Duckbill Valves (3 Month Supply) | GLP-1 Support (6 Month Supply)
54,laundry sauce,pier39.fly.dev/laundry-sauce,28,general,—,"laundry sauce — premium quality, fair prices.",2026-06-09,The Essentials Package | The Signature Package | The Holiday Package | Most Popular Package
55,Larson Jewelers,pier39.fly.dev/larson-jewelers,2496,general,—,"Larson Jewelers — premium quality, fair prices.",2026-06-09,1 Carat Certified Marquise Loose Stone Lab Grown Diamond No. 2030096 | 1 Carat Certified Marquise Loose Stone Lab Grown Diamond No. 8116252 | 0.91 Carat Certified Marquise Loose Stone Lab Grown Diamond No. 2035819 | 7.46 Carat Certified Emerald Loose Stone Lab Grown Diamond No. 1059985
56,Lancer Skincare,pier39.fly.dev/lancer-skincare,62,general,—,"Lancer Skincare — premium quality, fair prices.",2026-06-09,Lancer Spa Headband | Peptide Firming Duo | Advanced Treatment Duo | Daily Defense Duo
57,La Senza,pier39.fly.dev/la-senza,2500,general,—,"La Senza — premium quality, fair prices.",2026-06-09,Up 2 Cup Plunge Bra with Exquisite Lace in Tuxedo Black | Up 2 Cup Plunge Bra with Exquisite Lace in Pink Lemonade | Diva Thong Panty with Exquisite Lace in Tuxedo Black | Diva Thong Panty with Exquisite Lace in Pink Lemonade
58,L'AGENCE,pier39.fly.dev/l-agence,1659,general,—,"L'AGENCE — premium quality, fair prices.",2026-06-09,Otera Suede Belt | Janus Cover-Up Robe | Allanah Pinstriped Trouser | Krysta Halter Bikini Top
59,Kut From The Kloth,pier39.fly.dev/kut-from-the-kloth,497,general,—,"Kut From The Kloth — premium quality, fair prices.",2026-06-09,"Ashton Twill Stripe Short, Exclusive in Red/Wht | Kelsey Twill High Rise Ankle Flare, Exclusive in Navy/Ivory | Charlotte Twill High Rise Wide Leg, Exclusive in Matcha Green | Charlotte High Rise Wide Leg, Exclusive in Pink Diamond"
60,Koi CBD,pier39.fly.dev/koi-cbd,37,general,—,"Koi CBD — premium quality, fair prices.",2026-06-09,MusciMind™ Liquid Trip | The All-Day Wellness Pack | Koi CBD Balm | YEEHAW Mushroom Chocolate Bars
61,Kizik,pier39.fly.dev/kizik,314,general,—,"Kizik — premium quality, fair prices.",2026-06-09,Men's Vegas 2 - Bright White | Men's Vegas 2 - Tan Suede | Men's Vegas 2 - Grey Suede | Men's Athens Golf - Harbor Mist/Dark Shadow
62,Kinn Studio,pier39.fly.dev/kinn-studio,1049,general,—,"Kinn Studio — premium quality, fair prices.",2026-06-09,2.26ct GIA Oval D/VVS1 Lab Grown | Vintage Omega Watch | 1.01ct GIA Pear D/VVS1 Lab Grown | 1.01ct GIA Pear D/VVS1 Lab Grown
63,Kim Seybert,pier39.fly.dev/kim-seybert,748,general,—,"Kim Seybert — premium quality, fair prices.",2026-06-09,"Dip Dye Napkin in Blush & Gold, Set of 4 | Scallop Bud Vase in Pink | Herringbone Placemat in Tan, Set of 4 | Dip Dye Napkin in Periwinkle & White, Set of 4"
64,Keller International,pier39.fly.dev/keller-international,339,general,—,"Keller International — premium quality, fair prices.",2026-06-09,Triad Cutting Stool | INFINITY Premium Head Spa | JUPITER Non-Plumbing Portable Head Spa Kit | Derma Hair Steamer & Scalp Therapy Mist
65,Kate Somerville US,pier39.fly.dev/kate-somerville-us,64,general,—,"Kate Somerville US — premium quality, fair prices.",2026-06-09,Kate Somerville Puffer Pouch | The ExfoliKate Icons Kit | HydraKate® Pro-Collagen Lip Oil Elixir Duo | Goat Milk Soothing Body Lotion
66,JLUXLABEL,pier39.fly.dev/jluxlabel,1455,general,—,"JLUXLABEL — premium quality, fair prices.",2026-06-09,White/Black Venus Reversible Skirt Set | Beige Nightfall Suede Jacket | Black Wanderlust One Shoulder Dress | Yellow Island Bloom Hair Clip Set
67,Jack Archer,pier39.fly.dev/jack-archer,203,general,—,"Jack Archer — premium quality, fair prices.",2026-06-09,Clubhouse Pique Polo Pack | The Pique Polo 2-Pack | The Pique Polo 3-Pack | Legacy Resort Polo -- Harbor Blue
68,Intelligentsia Coffee,pier39.fly.dev/intelligentsia-coffee,337,general,—,"Intelligentsia Coffee — premium quality, fair prices.",2026-06-09,Colombia La Estrella | KINTO Sketch Tumbler 8oz | The Los Angeles KINTO Mug | The Chicago KINTO Mug
69,Innovix Labs,pier39.fly.dev/innovix-labs,12,general,—,"Innovix Labs — premium quality, fair prices.",2026-06-09,Black Seed Oil Softgels (500mg) | Triple Strength Omega-3 (30ct Softgels) | Collagen Peptides | Choline
70,Inno Supps,pier39.fly.dev/inno-supps,1709,general,—,"Inno Supps — premium quality, fair prices.",2026-06-09,3-Month Magnum Male Collection | Magnum Male Collection | Inno Cleanse™ | Inferno Shred Stack
71,Greyson Clothiers,pier39.fly.dev/greyson-clothiers,1184,general,—,"Greyson Clothiers — premium quality, fair prices.",2026-06-09,Coywolf Sport Vest | Leith Short Sleeve Sweater Polo | Detroit Tigers Colorado Quarter-Zip | Colorado Rockies Colorado Quarter-Zip
72,Good Ranchers,pier39.fly.dev/good-ranchers,116,general,—,"Good Ranchers — premium quality, fair prices.",2026-06-09,Father's Day Sampler Gift Box | Beef Sticks Special | Beef Chuck + Brisket Blend Patties Special | Center-Cut Filet Mignons
73,Glossier,pier39.fly.dev/glossier,113,general,—,"Glossier — premium quality, fair prices.",2026-06-09,You Look Good Pet Set | The Curbside Set | Smile Wave Pet Waste Bags | Pet Waste Bag Dispenser
74,Glasshouse Fragrances,pier39.fly.dev/glasshouse-fragrances,208,general,—,"Glasshouse Fragrances — premium quality, fair prices.",2026-06-09,Born To Be Extra | Rendezvous | Sunkissed In Bermuda | A Love Letter from Marseille
75,Giant Tiger,pier39.fly.dev/giant-tiger,2500,general,—,"Giant Tiger — premium quality, fair prices.",2026-06-09,"mySTYLE Women's Stretchy Crew Neck Tee | mySTYLE Women's Scooped Stretchy Tee | Bubly Sparkling Water Beverage Raspberry, 355 ml | CFL Calgary Stampeders Pillowcases, 20-in x 30-in, 2 Pack"
76,Gerber Childrenswear,pier39.fly.dev/gerber-childrenswear,2498,general,—,"Gerber Childrenswear — premium quality, fair prices.",2026-06-09,8-Pack Baby Neutral Holiday Drooling Bibs | 8-Pack Baby Girls Super Happy Drooling Bibs | 8-Pack Baby Boys Kids Club Drooling Bibs | Baby Neutral Pink Zip Front Sweatshirt
77,GAURI KOHLI,pier39.fly.dev/gauri-kohli,239,general,—,"GAURI KOHLI — premium quality, fair prices.",2026-06-09,Copenhagen Ice Bucket | Copenhagen Bar Tools | Coco & Charlie Marble Bird Objects | Jardin Verde Levanto Bath Set
78,Gardencup,pier39.fly.dev/gardencup,60,general,—,"Gardencup — premium quality, fair prices.",2026-06-09,Agave Mango Chia Pudding | Soba Noodle Bowl w/ Garlic Butter Shrimp | Soba Noodle Bowl w/ Garlic Butter Tofu | 9-Pack Sampler
79,GAMMA Sports,pier39.fly.dev/gamma-sports,227,general,—,"GAMMA Sports — premium quality, fair prices.",2026-06-09,Momentum 6 Plus | Scor-Post® Pro | Marathon DPC 15L Nat | Refill String Things
80,FYidoctors,pier39.fly.dev/fyidoctors,459,general,—,"FYidoctors — premium quality, fair prices.",2026-06-09,DAESHA 2/G/S | DALIA 3/G/S | DAINA 2/G/S | JENELL 2/S
81,Forever 21,pier39.fly.dev/forever-21,2499,general,—,"Forever 21 — premium quality, fair prices.",2026-06-09,Chunky Faux Leather Sandals | Camo Print Longline Puffer Vest | Champion Big And Tall Men's Powerblend Fleece Sweat Pant | Long Sleeves Metallic Logo Po Hoodie
82,Fore All,pier39.fly.dev/fore-all,648,general,—,"Fore All — premium quality, fair prices.",2026-06-09,Noel Tee - White/Putting Green | Barbie Top - Putting Green/White Chevron | Barbie Top - White/Black Chevron | Noel Tee - White/Black
83,Flamingo Estate,pier39.fly.dev/flamingo-estate,139,general,—,"Flamingo Estate — premium quality, fair prices.",2026-06-09,Highland Park Jalapeño Candle | 2026 Summer Spicy Set | Spicy Tomato Savory Jam | Salsa Macha Chile Crisp
84,First Aid Beauty,pier39.fly.dev/first-aid-beauty,86,general,—,"First Aid Beauty — premium quality, fair prices.",2026-06-09,Brighten + Glow Exfoliating Gel Cleanser with AHA and Jojoba Pearls | Ultra Light Liquid Mineral Sunscreen with Zinc Oxide SPF 30 | Ultimate Hydration Routine | Sensitive Skin Bestsellers
85,Felina,pier39.fly.dev/felina,407,general,—,"Felina — premium quality, fair prices.",2026-06-09,Cotton Modal Brief Underwear 5-Pack | Cotton Modal Bikini Underwear 5-Pack | Lunette Convertible T-Shirt Bra | Lunette Convertible T-Shirt Bra
86,Feastables,pier39.fly.dev/feastables,32,general,—,"Feastables — premium quality, fair prices.",2026-06-09,Milk Chocolate Pantry Pack | Mario Sour Boosts | Mario Galaxy Cocoa Crunch | Yoshi Eggs
87,Farmacy Beauty,pier39.fly.dev/farmacy-beauty,115,general,—,"Farmacy Beauty — premium quality, fair prices.",2026-06-09,Healthy Skin Trio | Honey Hydration Trio | Cleanse + Comfort Trio | Honey Barrier Trio
88,Face Reality Skincare,pier39.fly.dev/face-reality-skincare,85,general,—,"Face Reality Skincare — premium quality, fair prices.",2026-06-09,FACE FOUNDRIÉ Opening Bundle | Clear Skin Peel Bundle | Clear Synergy Peel Bundle | Clear Synergy Peel 3
89,Et Tigre,pier39.fly.dev/et-tigre,125,general,—,"Et Tigre — premium quality, fair prices.",2026-06-09,Kara Dress in Black | Francis Crop Top in White | Jackie Boot in Nubuck Suede | Sully Blouse in White
90,Elvie,pier39.fly.dev/elvie,63,general,—,"Elvie — premium quality, fair prices.",2026-06-09,Breast Pump Sizing Kit | Colostrum Collection Kit | Willow Wave Valves Set (4-pack) | Willow Wave Tubing
91,effyjewelry.com,pier39.fly.dev/effyjewelry-com,2500,general,—,"effyjewelry.com — premium quality, fair prices.",2026-06-09,Emerald 2.03ct E VS2 | Emerald 1.18ct D IF | Radiant 1.92ct D VS1 | Emerald 0.38ct D VVS2
92,Dr. Brandt Skincare,pier39.fly.dev/dr-brandt-skincare,75,general,—,"Dr. Brandt Skincare — premium quality, fair prices.",2026-06-09,Clean Biotic | Dee & Ricky Limited Edition Hope T-Shirt | Dr BRANDT HEARTS 4 YOU T. SHIRT | Discovery Kit
93,Davis Instruments,pier39.fly.dev/davis-instruments,220,general,—,"Davis Instruments — premium quality, fair prices.",2026-06-09,"Yagi Antenna for Long-Range Repeater - SKU 7660 | EnviroMonitor Gateway (LTE, Latest Version) - SKU 6803 | Vantage Pro2 Plus Upgrade Kit - SKU 6496 | Vantage Vue Weather Station with WeatherLink Console - SKU 6242, 6242M"
94,Dansko,pier39.fly.dev/dansko,450,general,—,"Dansko — premium quality, fair prices.",2026-06-09,Pro Clog Pastel Rainbow Glitter | Wide Pro Pastel Rainbow Glitter | Professional Watercolor | Kane Paisley Bandana
95,Dandelion Chocolate,pier39.fly.dev/dandelion-chocolate,190,general,—,"Dandelion Chocolate — premium quality, fair prices.",2026-06-09,"DCJ - Semuliki Forest, Uganda 85% Single-Origin Chocolate Bar | Aperitivo & Digestivo Collection | Summer Harvest Collection | Midnight Sun Collection"
