#,Name,Domain,Products,Categories,City,Tagline,Added,Sample Products
96,Daily Harvest,pier39.fly.dev/daily-harvest,68,general,—,"Daily Harvest — premium quality, fair prices.",2026-06-09,New Mom Nutrition Bundle | High Protein Oat Bowl Bundle | High Protein Smoothie Bundle (12-pack) | High Protein Smoothie Bundle (6-pack)
97,D'vash Organics,pier39.fly.dev/d-vash-organics,17,general,—,"D'vash Organics — premium quality, fair prices.",2026-06-09,Premium Date Sugar | Pistachio Fiber Bars 6pk | Peanut Butter Fiber Bars 6pk | Pecan Cacao Fiber Bars 6 pk
98,Cozy Earth,pier39.fly.dev/cozy-earth,578,general,—,"Cozy Earth — premium quality, fair prices.",2026-06-09,Men's Brushed Bamboo Hoodie | Women's Chelsea Short | Women's Chelsea Short Sleeve | Women's Chelsea Short Sleeve Set
99,CMY Cubes,pier39.fly.dev/cmy-cubes,47,general,—,"CMY Cubes — premium quality, fair prices.",2026-06-09,The Ultimate Puzzle Aenigma | The Collection Mysterium | SECONDS: The PolySquish Discovery Series | The Aeternus Aenigma - Series Monochromatica
100,Clare V,pier39.fly.dev/clare-v,583,general,—,"Clare V — premium quality, fair prices.",2026-06-09,Shortie Strap | Coin Clutch | Carryall Clutch w/ Tabs | Coin Clutch
101,Catchmaster,pier39.fly.dev/catchmaster,91,general,—,"Catchmaster — premium quality, fair prices.",2026-06-09,"Window Fly Traps Decorative Linen 12-Pack | Fly Traps for Window Corners, Decorative 12-Pack | Window Fly Traps Decorative 12-Pack | Vector 9 UV Light Plug in Flying Insect Trap"
102,California Furniture Store,pier39.fly.dev/california-furniture-store,2500,general,—,"California Furniture Store — premium quality, fair prices.",2026-06-09,Anabelle Bed | Anabelle Bed | Amos Multi 5' X 8' Area Rug | Alzire Black Cal.King Bed
103,California Filament,pier39.fly.dev/california-filament,82,general,—,"California Filament — premium quality, fair prices.",2026-06-09,Spring 2026 Limited Edition Pack | Champagne Blush Limited Edition PETG Filament 1.75mm | Cream Limited Edition PETG Filament 1.75mm | Powder Blue Limited Edition PETG Filament 1.75mm
104,Caldera + Lab,pier39.fly.dev/caldera-lab,29,general,—,"Caldera + Lab — premium quality, fair prices.",2026-06-09,The Weekender Kit | The Face Towel | The Body Bar Mini | The Power Pair
105,BWH Plant Co,pier39.fly.dev/bwh-plant-co,241,general,—,"BWH Plant Co — premium quality, fair prices.",2026-06-09,"Craft Cafe | 4"" Variegated Alocasia Sanderiana Bull 'Aurea' | 6"" Monstera Borsigiana Albo | 4"" Aglaonema 'Spilt Milk'"
106,Burt's Bees Baby,pier39.fly.dev/burt-s-bees-baby,684,general,—,"Burt's Bees Baby — premium quality, fair prices.",2026-06-09,Vintage Wash Football Sweatshirt Set | Autumn Rose Organic Cotton Tunic Set | Wild Floral Organic Cotton Dress | Top Dog Baby Boy Bodysuits 2 Pack
107,Burst Oral Care,pier39.fly.dev/burst-oral-care,97,general,—,"Burst Oral Care — premium quality, fair prices.",2026-06-09,Father's Day Bundle | Interdental Floss Picks | Dissolving Breath Strips | Precision Whitening Pen
108,Built Bar,pier39.fly.dev/built-bar,70,general,—,"Built Bar — premium quality, fair prices.",2026-06-09,Coconut Puff 4ct | Mint Chip Puff 4ct | Brownie Batter Puff 4ct | Cookie Dough Chunk Puff 4ct
109,Blundstone,pier39.fly.dev/blundstone,215,general,—,"Blundstone — premium quality, fair prices.",2026-06-09,Men's Classics #2340 | Men's Lug #2240 | Women's Lug #2240 | Men's Lug #2238
110,bloom baby,pier39.fly.dev/bloom-baby,52,general,—,"bloom baby — premium quality, fair prices.",2026-06-09,fresco de-luxe seat liner | alma papa crib breathable mattress | alma grow crib bundle (July Delivery) | fresco titanium (July delivery)
111,Billy Reid,pier39.fly.dev/billy-reid,491,general,—,"Billy Reid — premium quality, fair prices.",2026-06-09,Short Sleeve Linen Tuscumbia Shirt Button Down | Pensacola Polo | Vintage Stripe Sweater Polo | Short Sleeve Numajiri Beach Shirt
112,Bikes Online,pier39.fly.dev/bikes-online,1102,general,—,"Bikes Online — premium quality, fair prices.",2026-06-09,Shimano GRX REAR DERAILLEUR RD-RX822 12-Speed | Shimano XTR Rear Derailleur RD-M9100 | Shimano XTR M9250 12-SPEED KIT | Crankbrothers Synthesis Enduro Alloy Wheelset - OEM
113,Bells of Steel,pier39.fly.dev/bells-of-steel,229,general,—,"Bells of Steel — premium quality, fair prices.",2026-06-09,"Basilisk Stack Loaded Leg Extension / Leg Curl | Hydra Six Post Power Rack - Prebuilt (3"" x 3"", ⅝"" Holes) | Fat Bar - Lat Pulldown Bar | All-in-One Trainer - OLD Version on Clearance"
114,Bellami,pier39.fly.dev/bellami,1214,general,—,"Bellami — premium quality, fair prices.",2026-06-09,Master Class (All 4 Methods) & Kit | DUBOIS PA - 09/20/2026 - 09/21/2026 | BELLAMI Cutting Techniques Class | ELMHURST IL - 09/14/2026 | BELLAMI Cutting Techniques Class | TUKWILA WA - 09/21/2026 | Advanced Education (BELLAMI Hidden Row) & Kit | VERONA NJ - 09/14/2026
115,BEARPAW,pier39.fly.dev/bearpaw,564,general,—,"BEARPAW — premium quality, fair prices.",2026-06-09,ALTITUDE BLACK | MINDY HICKORY | EMMA SHORT BLACK | LOKETTA GRAY FOG
116,Bad Birdie,pier39.fly.dev/bad-birdie,441,general,—,"Bad Birdie — premium quality, fair prices.",2026-06-09,"Greens Keeper | USA All day, Let's Play | Salt Shaker - Black | Ditsy Down"
117,Art of Skincare,pier39.fly.dev/art-of-skincare,750,general,—,"Art of Skincare — premium quality, fair prices.",2026-06-09,Colorescience Summer Essentials Gift Set | Epicutis Luxury On The Go Set | Skinbetter InterFuse Treatment Cream EYE Mini | Colorescience Total Protection Body Shield Glow SPF 50
118,Arhaus,pier39.fly.dev/arhaus,2494,general,—,"Arhaus — premium quality, fair prices.",2026-06-09,Coventry Dining Table | Winslow Accent Table Lamp | Del Rey Outdoor Dining Side Chair | Montauk Outdoor Swivel Chair in Vista Grey
119,Apothekary,pier39.fly.dev/apothekary,46,general,—,"Apothekary — premium quality, fair prices.",2026-06-09,Fuel to Burn | Power Trip™ | AM to PM Duo | Metabolic Duo
120,ALOHA,pier39.fly.dev/aloha,66,general,—,"ALOHA — premium quality, fair prices.",2026-06-09,"Pumpkin Spice - Protein Bars | Banana Bread Chocolate Chip - Protein Bars | Almond Butter Cup (Best By July 31st, 2026) - Protein Bars | Key Lime - Protein Bars"
121,Alo Yoga,pier39.fly.dev/alo-yoga,2497,general,—,"Alo Yoga — premium quality, fair prices.",2026-06-09,Tennis Club Sweater Knit Cardigan - Candy Red/White | Airlift Suit Up Bra - Spruce Green/White | Fan Club Mini Skirt - Black | Unisex Throwback Sock - Marathon Blue/White
122,Alexis Russell,pier39.fly.dev/alexis-russell,1696,general,—,"Alexis Russell — premium quality, fair prices.",2026-06-09,1.17ct | Salt & Pepper Kite Shape Step Cut Diamond | 1.06ct | Salt & Pepper Shield Shape Step Cut Diamond | 1.51ct | Salt & Pepper Pear Shape Brilliant Cut Diamond | 1.19ct | Salt & Pepper Pear Shape Rose Cut Diamond
123,Alessi,pier39.fly.dev/alessi,1544,general,—,"Alessi — premium quality, fair prices.",2026-06-09,9098 | 9098 B/POM | 9096 | La cupola
124,Alembika.com,pier39.fly.dev/alembika-com,2499,general,—,"Alembika.com — premium quality, fair prices.",2026-06-09,"The Essential Trio | Layla Box Shirt, Black/White Stripe | Lucent Oversized Dress, Sheer White | Evanescent Oversized Shirt, Sheer White"
125,Address America,pier39.fly.dev/address-america,186,general,—,"Address America — premium quality, fair prices.",2026-06-09,"Poly Spear, Boy Scout, White. Fits 5/8"" Square 10 pk | Cast Iron Spear Trident Fits 1/2"" Square 10 pk | Polished Brass Tri Spear Finial 4 1/2"" H Fits Over 1/2"" Square Tube | 16"" X 12"" Powder-Coated Black Stainless-Steel Blank"
126,7 For All Mankind,pier39.fly.dev/7-for-all-mankind,1388,general,—,"7 For All Mankind — premium quality, fair prices.",2026-06-09,TAILORLESS DOJO in Comfort Blue Haze | LONG SLEEVE WESTERN SHIRT in Denim Canyon | SHORT SLEEVE REGULAR SHIRT in Denim Duster | LONG SLEEVE REGULAR SHIRT in Denim Abyss
127,100 Thieves,pier39.fly.dev/100-thieves,400,general,—,"100 Thieves — premium quality, fair prices.",2026-06-09,HSTN 100 Thieves Collection | Premium :: Pendant | Select :: Tapestry | Deluxe :: T-Shirt
128,021 Originals,pier39.fly.dev/021-originals,153,general,—,"021 Originals — premium quality, fair prices.",2026-06-09,021 ESSENTIAL DROP-CUT HENLEY - DELUXE BUNDLE | 021 ESSENTIAL DROP-CUT HENLEY - DUSTY ROSE | 021 ESSENTIAL DROP-CUT HENLEY - SEA FOAM | 021 ESSENTIAL DROP-CUT HENLEY - SAND
129,Target,pier39.fly.dev/target,197,"general, department_store, home, beauty, grocery, electronics","Minneapolis, MN","Expect more. Pay less. — over 100,000 SKUs across home, beauty, grocery, electronics, and apparel.",2026-05-09,"FAMYYT 30 in. Single Sink Freestanding Green Bath Vanity with White Ceramic Top, Divided Drawers, Door Racks | Pokemon All-Over Print Women'e Novelty Cosmetic Bag | HANDPOINT 86994 Slip Resistant Durability 8"" Leather Work Boots | COZONY 2-Tier Stainless Steel Table with Wheels, 60x24 Commercial Worktable with Trash Rack | HomeRoots 63"" White and Silver Wood and Metal Pedestal Base Dining Table"
130,Zorrata,pier39.fly.dev/zorrata,187,general,—,"Zorrata — premium quality, fair prices.",2026-05-08,Isle Stack | Desert Stack | Midnight Stack | Glacier Stack
131,Zippo USA,pier39.fly.dev/zippo-usa,1601,general,—,"Zippo USA — premium quality, fair prices.",2026-05-08,B2B - Classic Brushed Chrome | B2B - Classic Black Matte | 2026 Harley-Davidson® Limited Edition Lighter of the Year | NHL® 100th Anniversary Teams
132,zen minded,pier39.fly.dev/zen-minded,1267,general,—,"zen minded — premium quality, fair prices.",2026-05-08,Mountain Illusions Incense Sticks | MD Paper Notebook - A6 Lined | Chirirenge Soup Spoon - Oribe | Linen Tea Towel - Red Stripe
133,Yes We Vibe,pier39.fly.dev/yes-we-vibe,2422,general,—,"Yes We Vibe — premium quality, fair prices.",2026-05-08,Sunflower Peace | Silver Spring Pediatrics Fade | Silver Spring Pediatrics | Peace Pattern
134,Xhibition,pier39.fly.dev/xhibition,854,general,—,"Xhibition — premium quality, fair prices.",2026-05-08,Bauhaus Flight | Wide Pusher Pants | Wide Pusher Shorts | Stefan Cargo
135,XGaming,pier39.fly.dev/xgaming,45,general,—,"XGaming — premium quality, fair prices.",2026-05-08,(20) Buttons With Microswitches | TIME BREAKER LIGHTGUN FOR PS1/PS2 | Upgraded Power Supply for X-Force Haptics Kit (Noise Reduction Edition) | X-Arcade Gen2 Wireless Dongle (Upgrade for Arcade2TV-XR / Tankstick VR ONLY)
136,WYO,pier39.fly.dev/wyo,417,general,—,"WYO — premium quality, fair prices.",2026-05-08,Move In Silence T-Shirt | Ram Naam Aura T-Shirt | Unstoppable Predator T-Shirt | SKY T-Shirt
137,Womens Best,pier39.fly.dev/womens-best,791,general,—,"Womens Best — premium quality, fair prices.",2026-05-08,Gentle Iron + Vitamin C Capsules (25mg) | Essential High Waist Flared Leggings | Mauve Taupe | Essential High Waist Flared Leggings | Cafe Noir | Comfort Ribbed Cropped Tank | Mauve Taupe
138,Wish Atlanta,pier39.fly.dev/wish-atlanta,1694,general,—,"Wish Atlanta — premium quality, fair prices.",2026-05-08,Nike Air Max 95 OG 'Big Bubble Lake Blue' | Adrenaline GTS 10 'Bronze Green' | The Boy White Dog Tee | 3-in-1 Tee
139,Wildflower Cases,pier39.fly.dev/wildflower-cases,452,general,—,"Wildflower Cases — premium quality, fair prices.",2026-05-08,Latte Love | Midnight iPhone Case | Latte Love | Midnight Samsung Galaxy Case | Forget Me Not Floral | Pink Samsung Galaxy Case | Forget Me Not Floral | Pink iPhone Case
140,Wigs,pier39.fly.dev/wigs,2440,general,—,"Wigs — premium quality, fair prices.",2026-05-08,Carolina | Synthetic Lace Front Wig (Hand Tied) | Emilia | Synthetic Lace Front Wig (Hand Tied) | Elsa | Synthetic Lace Front Wig (Hand Tied) | Clare | Synthetic Lace Front Wig (Hand Tied)
141,Wicked Clothes,pier39.fly.dev/wicked-clothes,282,general,—,"Wicked Clothes — premium quality, fair prices.",2026-05-08,'May Be Dumb' Sweatshirt | 'True Crime Club' Bumper Magnet | 'Lollygagging Frog' Sticker | 'Lollygagging Frog' Shirt
142,What Do You Meme,pier39.fly.dev/what-do-you-meme,214,general,—,"What Do You Meme — premium quality, fair prices.",2026-05-08,"What Do You Meme? Drew Afualo Expansion Pack by Relatable – Card Games for Adults, Featuring All New Meme Game Content – Includes 15 Image Cards and 10 Caption Cards | Lil Cheers Birthday Cupcake by Relatable – Crochet Plush with Motivational Sign, Great Birthday Gifts, Birthday Plush, Comfort Gifts & Desk Buddy | Lil Cheers Get Well Soon Cactus by Relatable – Crochet Plush with Motivational Sign, Great Get Well Soon Gifts, Feel Better Gift, Comfort Gifts & Desk Buddy | Happy Helpers Sloth Cooling Headache Cap by Relatable, Perfect for Soothing Support During Headaches, Hangovers, Post Workout Recovery, Stress Support and Cooling Support,  Includes 1 Cooling Cap"
143,Wandrd,pier39.fly.dev/wandrd,308,general,—,"Wandrd — premium quality, fair prices.",2026-05-08,PRVKE Lite in Black | PRVKE Lite in Wasatch Green | PRVKE Lite | PRVKE EDC 10-Year Edition
144,Waist Shaperz,pier39.fly.dev/waist-shaperz,175,general,—,"Waist Shaperz — premium quality, fair prices.",2026-05-08,Back Support Bra | High Stretchy Seamless Sling Tummy Control Jumpsuit Removable cup pads | Post-op Chest Wrap Tummy Control Full Body Shapewear | Sexy Lace Firm Compression Latex Buttocks Lifting Shapewear
145,VRS Design,pier39.fly.dev/vrs-design,214,general,—,"VRS Design — premium quality, fair prices.",2026-05-08,Galaxy Z Fold 7 & Flip 7 Case Front Cover Replacement ONLY | Google Pixel Fold Case Terra Guard Modern GO Series | Google Pixel Fold Case Simpli Fit Modern series | Galaxy Z Flip 5 Case Terra Guard Active
146,Vitaly,pier39.fly.dev/vitaly,247,general,—,"Vitaly — premium quality, fair prices.",2026-05-08,Glint | Ebb | Confine | Terra
147,Vincero Collective,pier39.fly.dev/vincero-collective,567,general,—,"Vincero Collective — premium quality, fair prices.",2026-05-08,Built Different: The Wolf - Stealth | Built Different: The Lion - Stealth | Crucifix Pendant - Stealth | Cross Pendant - Stealth
148,Velvet Caviar,pier39.fly.dev/velvet-caviar,2496,general,—,"Velvet Caviar — premium quality, fair prices.",2026-05-08,Olive & June x VC Case | Espresso Bow Bag Charm | Matcha Stars Bag Charm | Matcha Swirl Crystal Bow Hair Clip
149,Velasca,pier39.fly.dev/velasca,1627,general,—,"Velasca — premium quality, fair prices.",2026-05-08,Peschici | Lerici | Balòss | Esercent
150,Vapoureyes,pier39.fly.dev/vapoureyes,2500,general,—,"Vapoureyes — premium quality, fair prices.",2026-05-08,Scratch and Dent Mystery Hardware Lucky Dip — EOFY 2024 | Vapefly Kriemhild II (2) Subohm Tank | Vapefly Kriemhild Subohm Tank | Geekvape Z RDA
151,Vapor Authority,pier39.fly.dev/vapor-authority,2499,general,—,"Vapor Authority — premium quality, fair prices.",2026-05-08,Uwell Valyrian IV Tank Accessories Kit | UWell Valyrian IV Sub Ohm Tank | Aspire Zelos M80 Box Mod | Aspire Zelos M80 Starter Kit
152,Vanity Planet,pier39.fly.dev/vanity-planet,42,general,—,"Vanity Planet — premium quality, fair prices.",2026-05-08,The Head-To-Toe Ritual | The Dewy Ritual | The Glow Revival Ritual | The Pore Reset Ritual
153,Valfre,pier39.fly.dev/valfre,149,general,—,"Valfre — premium quality, fair prices.",2026-05-08,1984 Sketchbook | Maze Woven Blanket | Flora Carnivora Woven Blanket | Cloud Woven Blanket
154,United By Blue,pier39.fly.dev/united-by-blue,853,general,—,"United By Blue — premium quality, fair prices.",2026-05-08,(R)evolution™ 3.5L Mini Tote | (R)evolution™ Daily Cross Body | Yak Wool - Ultimate Full Cushion Boot Sock | The Westward Tote
155,Uniqfind,pier39.fly.dev/uniqfind,2356,general,—,"Uniqfind — premium quality, fair prices.",2026-05-08,Ivory White Impact iPhone Case | Cowhide Impact iPhone Case | Tortoise Shell Impact iPhone Case | Leopard Impact iPhone Case
156,UNIF,pier39.fly.dev/unif,450,general,—,"UNIF — premium quality, fair prices.",2026-05-08,Marks and Spencer Red Plaid Bias Dress | Vintage Lavender Gharani Strok Bias Dress | Vintage Lavender Next Dress | Vintage Burgundy Betsy Johnson Dress
157,U Turn Audio,pier39.fly.dev/u-turn-audio,95,general,—,"U Turn Audio — premium quality, fair prices.",2026-05-08,"Daft Punk ""Random Access Memories"" (180 Gram/2 LP) | Leather Mat | Oasis ""(What's The Story) Morning Glory?"" (2 LP) | Stylus Brush"
158,Secret Woods,pier39.fly.dev/secret-woods,135,general,—,"Secret Woods — premium quality, fair prices.",2026-05-08,GLO | Eternal Supernova Size - 13.5 | Le Bouquet Size - 10.5 | FOX
159,Rothys,pier39.fly.dev/rothys,647,general,—,"Rothys — premium quality, fair prices.",2026-05-08,The Almond Slingback - Butterscotch Stripe | The Travel Sling - Forest | The Travel Duffel - Forest | The Travel Duffel - Ink
160,Rocketbook,pier39.fly.dev/rocketbook,50,general,—,"Rocketbook — premium quality, fair prices.",2026-05-08,"Multi Subject Notebook - Next Gen | Orbit Pad, Pen, and Cloth (Final Sale) | Frixion Fineliner Markers (4 Pack) | Frixion Pen (12 Pack)"
161,Retro Supply Co,pier39.fly.dev/retro-supply-co,410,general,—,"Retro Supply Co — premium quality, fair prices.",2026-05-08,"Chromatone Marker Studio for Photoshop | Chromatone Marker Studio for Procreate | Gravedigger | Freelance, and Business, and Stuff Ebook"
162,Represent Clothing,pier39.fly.dev/represent-clothing,1429,general,—,"Represent Clothing — premium quality, fair prices.",2026-05-08,Initial Mule - Black | Represent Owners Club Long Sleeve T-Shirt - Chalk | Represent Owners Club Washed Cap - Sienna | Represent Owners Club Washed Cap - Sky Blue
163,Renee Rouleau,pier39.fly.dev/renee-rouleau,84,general,—,"Renee Rouleau — premium quality, fair prices.",2026-05-08,MINI Rapid Response Detox Cleanser | Dark Spot Fade Hyperpigmentation Toolkit | Post-Breakout Fade Hyperpigmentation Toolkit | Bright Now Oil Serum
164,Regal Rose,pier39.fly.dev/regal-rose,1029,general,—,"Regal Rose — premium quality, fair prices.",2026-05-08,SOLARIS. Flaming Sun Amber Stud Earring - Silver | SOLARIS. Flaming Sun Amber Choker - Gold | SOLARIS. Flaming Sun Amber Ring - Silver | SOLARIS. Flaming Sun Amber Ring - Gold
165,RDKLU,pier39.fly.dev/rdklu,1817,general,—,"RDKLU — premium quality, fair prices.",2026-05-08,PLAIN SHIRT #23 | PLAIN SHIRT #22 | PLAIN SHIRT #21 | GHOSTWASH * Tee #43
166,RAGS,pier39.fly.dev/rags,209,general,—,"RAGS — premium quality, fair prices.",2026-05-08,Adult Short Sleeve Crewneck - Black & White Mini Check | Women's Tank Romper - Light Black Pinstripe | Strappy Jumper - Olive Polka Dot | Rag Romper - Washed B&W Check
167,Radha Beauty,pier39.fly.dev/radha-beauty,45,general,—,"Radha Beauty — premium quality, fair prices.",2026-05-08,USDA Organic 100% Pure Argan Oil | Ylang Ylang Essential Oil 5 mL | 100% Pure Castor Oil 16oz | Vitamin C Complete Facial Care Kit
168,Rad Power Bikes,pier39.fly.dev/rad-power-bikes,155,general,—,"Rad Power Bikes — premium quality, fair prices.",2026-05-08,Extend Protection Plan | Extend Protection Plan | Extend Protection Plan | RadWagon™ Electric Cargo Bike
169,Qwerkywriter,pier39.fly.dev/qwerkywriter,32,general,—,"Qwerkywriter — premium quality, fair prices.",2026-05-08,"Switch Installation | REFURBISHED BLACK CHROME QWERKYWRITER® US Layout | Cherry MX2 Speed Silver Set of 21 ""Stealth"" Switches For Numkey Quiet Linear Factory Lubed | Cherry MX2 Speed Silver Set of 85 ""Stealth"" Switches Quiet Linear Factory Lubed"
170,Quay Australia,pier39.fly.dev/quay-australia,174,general,—,"Quay Australia — premium quality, fair prices.",2026-05-08,SEE YA | AURA POINTS | DND | COME THRU
171,Q-See,pier39.fly.dev/q-see,13,general,—,"Q-See — premium quality, fair prices.",2026-05-08,"Qsee 5MP Analog CCTV Cameras with Color Night Vision -4PCs, QH05YC | Qsee 5MP Infrared Analog Cameras with PIR Sensor -4PCs, QH05FR | Qsee 4K 16-Channel 16 PoE Port NVR QP16080NR (No HDD) | Qsee 5MP 2TB DVR Siren Security Camera System with Active Deterrence QH08045HW"
172,PITAKA,pier39.fly.dev/pitaka,52,general,—,"PITAKA — premium quality, fair prices.",2026-05-08,Breath of Veins Phone Cases | PitaTag for Cable | Ink Horse Painting Phone Cases | MagEZ Grip (Gift for The Survey)
173,Peel,pier39.fly.dev/peel,298,general,—,"Peel — premium quality, fair prices.",2026-05-08,iPhone 17 Case + Screen Protection Bundle | Samsung Galaxy S26 Ultra Privacy Glass Screen Protector | Samsung Galaxy S26 Privacy Glass Screen Protector | Samsung Galaxy S26 Plus Privacy Glass Screen Protector
174,Out of the Sandbox,pier39.fly.dev/out-of-the-sandbox,47,general,—,"Out of the Sandbox — premium quality, fair prices.",2026-05-08,Vino Power Up | Amphora | Merlot | Vino
175,Out of Print,pier39.fly.dev/out-of-print,1376,general,—,"Out of Print — premium quality, fair prices.",2026-05-08,Fourth Wing Mugs | Mychal Threets: Library Joy Unisex Black T-Shirt | The Wind-Up Bird Chronicle Unisex Black T-Shirt | Kafka on the Shore Unisex Black T-Shirt
176,Only NY,pier39.fly.dev/only-ny,294,general,—,"Only NY — premium quality, fair prices.",2026-05-08,Only NY x MoMA Community of New York Wall Clock | Bouquet Pocket T-Shirt | Diver Loon Marled Sweater | MTA NYC Token Pocket T-Shirt
177,OnlinePrasad,pier39.fly.dev/onlineprasad,757,general,—,"OnlinePrasad — premium quality, fair prices.",2026-05-08,Makar Sankranti : Brahman Bhoj at top temples | Rudra Abhishek Puja | Kedarnath Dham Prasad | Santan Gopal Puja
178,OFRA Cosmetic,pier39.fly.dev/ofra-cosmetic,993,general,—,"OFRA Cosmetic — premium quality, fair prices.",2026-05-08,RCK Highlighter - Famous Glow | RCK Blush – Hollywood | RCK Bronzer – Luxury | Mini - Long Lasting Liquid Lipstick - SoBe
179,OBEY Clothing,pier39.fly.dev/obey-clothing,1038,general,—,"OBEY Clothing — premium quality, fair prices.",2026-05-08,UNCONDITIONAL FREEDOM SHIRT | ALMOST FREE OBEY LS PIGMENT T-SHIRT | BRAIN CONTROLLER 6 PANEL | CHAOS & DISSENT PIGMENT T-SHIRT
180,Notre Shop,pier39.fly.dev/notre-shop,1349,general,—,"Notre Shop — premium quality, fair prices.",2026-05-08,Moon Shoe OG Sneaker in Summit White/Soft Pearl/Gum Light Brown | Moon Shoe OG Sneaker in Soft Yellow/Soft Pearl/Black | Moon Shoe OG Sneaker in Midnight Navy/Soft Pearl/Gum Light Brown | Otto 958 Gel SD Lyte Sneaker in Dioptase/Dioptase
181,Noise,pier39.fly.dev/noise,895,general,—,"Noise — premium quality, fair prices.",2026-05-08,Noise Jr. Explorer 2 Kids Smartwatch - Summer Drop | Noise 22 MM Silicone Strap for Halo 3 Smartwatch | Accidental & Liquid Damage Protection for Product Range Rs.9500 to Rs.9999 | Accidental & Liquid Damage Protection for Product Range Rs.3000 to Rs.3499
182,NoHow,pier39.fly.dev/nohow,1143,general,—,"NoHow — premium quality, fair prices.",2026-05-08,UNLINED SINGLE BREASTED BLAZER IN MUD | FORMAL PANTS IN MUD | FORMAL SUIT IN MUD | LINEN PINSTRIPED SUIT IN SAGE
183,Noah,pier39.fly.dev/noah,689,general,—,"Noah — premium quality, fair prices.",2026-05-08,Tri-Color Suede Island Slipper | Chainstitch Shop Tee | Oxford Shirt | Catch Ball D-02 Sneaker
184,Nisolo,pier39.fly.dev/nisolo,201,general,—,"Nisolo — premium quality, fair prices.",2026-05-08,Women's Huarache Sandal 2.0 Gold | Women's Huarache Sandal 2.0 Almond Snake | Lola Mary Jane Pearl | Lola Mary Jane Almond Snake
185,Nialaya Jewelry,pier39.fly.dev/nialaya-jewelry,669,general,—,"Nialaya Jewelry — premium quality, fair prices.",2026-05-08,Bold Layered Hoops in Gold | Gold Evil Eye Pendant Necklace | May Stack | Men's Silver Fleur de Lis Linked Bracelet
186,Next Deal Shop,pier39.fly.dev/next-deal-shop,1689,general,—,"Next Deal Shop — premium quality, fair prices.",2026-05-08,2 Pack - Adorable Puppy Toilet Roll Holder | Rustic Metal Butterfly & Flower Garden Stake | 4th of July Patriotic Gnome Window Clings | Colorful Tree of Life Metal Wall Art
187,Newbury Comics,pier39.fly.dev/newbury-comics,2500,general,—,"Newbury Comics — premium quality, fair prices.",2026-05-08,Middle of Nowhere CD (Indie Exclusive Signed) | Cinematic CD (Autographed) | Why Would I Watch CD with Autographed Postcard | An Ending In Itself CD (Autographed)
188,Nest Bedding,pier39.fly.dev/nest-bedding,295,general,—,"Nest Bedding — premium quality, fair prices.",2026-05-08,Cross Stitch Quilt Set | Stripe Comforter Set | Natural Non-Slip Yoga Mat | Wool myComforter®
189,Natural Stacks,pier39.fly.dev/natural-stacks,57,general,—,"Natural Stacks — premium quality, fair prices.",2026-05-08,NEUROFUEL™ Nootropic W/ Zembrin® | Dopamine Brain Food™ - 2 Pack | Serotonin Brain Food™ Mini Bottle (15ct) | Smart NMN™
190,Myles Apparel,pier39.fly.dev/myles-apparel,116,general,—,"Myles Apparel — premium quality, fair prices.",2026-05-08,Myles Gift Card | Momentum Tee in Heather Oxblood | Everyday Short in Bay Blue | Everyday Short in Eventide
191,MyIntent,pier39.fly.dev/myintent,69,general,—,"MyIntent — premium quality, fair prices.",2026-05-08,Her Next Era x MyIntent Bundle | Refill - Adjustable Necklaces | Mystery Word Bracelet | Daily Affirmation Necklace Kit
192,MyChoiceSoftware,pier39.fly.dev/mychoicesoftware,715,general,—,"MyChoiceSoftware — premium quality, fair prices.",2026-05-08,Microsoft 365 Business Premium + Copilot Business - 1 Month | Microsoft Windows Server 2025 Standard 16 Core + 50 Remote Desktop CALs | Microsoft Windows Server 2025 Standard 16 Core + 20 Remote Desktop CALs | Microsoft Windows Server 2025 Standard 16 Core + 10 Remote Desktop CALs
193,Muse-Themes,pier39.fly.dev/muse-themes,354,general,—,"Muse-Themes — premium quality, fair prices.",2026-05-08,Carousel Image Slider | Wufoo Forms | Floating Gallery | SEO Widget Pack
